"Authors","Author full names","Author(s) ID","Title","Year","Source title","Volume","Issue","Art. No.","Page start","Page end","Page count","Cited by","DOI","Link","Publisher","Document Type","Publication Stage","Open Access","Source","EID"
"Silva G.M.E.; Oliveira T.H.; Carvalho R.S.; Fialho H.C.P.; Souza F.A.A.D.; Mendiondo E.M.; Ghiglieno F.","Silva, Gabriel Marinho E (57652277200); Oliveira, Tassiana Halmenschlager (57213336798); Carvalho, Rafael Santos (57659221000); Fialho, Hailton Cesar Pimentel (57324505600); Souza, Felipe Augusto Arguello De (57216135240); Mendiondo, Eduardo Mario (7801402127); Ghiglieno, Filippo (7801414446)","57652277200; 57213336798; 57659221000; 57324505600; 57216135240; 7801402127; 7801414446","Assessing the Impact of SARS-CoV-2 on Water Consumption in São Paulo State, Brazil","2022","Journal of Water Resources Planning and Management","148","11","04022055","","","","1","10.1061/(ASCE)WR.1943-5452.0001606","https://www.scopus.com/inward/record.uri?eid=2-s2.0-85137109337&doi=10.1061%2f%28ASCE%29WR.1943-5452.0001606&partnerID=40&md5=180927c206f089668c519c6cf697afdf","American Society of Civil Engineers (ASCE)","Article","Final","","Scopus","2-s2.0-85137109337"
"Ayati A.H.; Haghighi A.","Ayati, Amir Houshang (57185500100); Haghighi, Ali (30467660000)","57185500100; 30467660000","Multiobjective Wrapper Sampling Design for Leak Detection of Pipe Networks Based on Machine Learning and Transient Methods","2023","Journal of Water Resources Planning and Management","149","2","04022076","","","","0","10.1061/JWRMD5.WRENG-5620","https://www.scopus.com/inward/record.uri?eid=2-s2.0-85142540427&doi=10.1061%2fJWRMD5.WRENG-5620&partnerID=40&md5=ea462aefc8253e233328e4f85758f6f3","American Society of Civil Engineers (ASCE)","Article","Final","","Scopus","2-s2.0-85142540427"
"Basnet L.; Brill D.; Ranjithan R.; Mahinthakumar K.","Basnet, Lochan (58294580600); Brill, Downey (58293804200); Ranjithan, Ranji (57000658900); Mahinthakumar, Kumar (6602708612)","58294580600; 58293804200; 57000658900; 6602708612","Supervised Machine Learning Approaches for Leak Localization in Water Distribution Systems: Impact of Complexities of Leak Characteristics","2023","Journal of Water Resources Planning and Management","149","8","04023032","","","","0","10.1061/JWRMD5.WRENG-6047","https://www.scopus.com/inward/record.uri?eid=2-s2.0-85160522416&doi=10.1061%2fJWRMD5.WRENG-6047&partnerID=40&md5=e05511bab115134871d8c6aa4967e5dd","American Society of Civil Engineers (ASCE)","Article","Final","","Scopus","2-s2.0-85160522416"
"Fernández García I.; Perea R.G.; Rodríguez Díaz J.A.","Fernández García, Irene (55617503300); Perea, Rafael Gonzalez (56018901200); Rodríguez Díaz, Juan Antonio (8551332200)","55617503300; 56018901200; 8551332200","New Model for Determining Optimal PAT Locations: Maximizing Energy Recovery in Irrigation Networks","2022","Journal of Water Resources Planning and Management","148","11","04022054","","","","1","10.1061/(ASCE)WR.1943-5452.0001605","https://www.scopus.com/inward/record.uri?eid=2-s2.0-85137087468&doi=10.1061%2f%28ASCE%29WR.1943-5452.0001605&partnerID=40&md5=f743bc452abf401654735566b4ab8324","American Society of Civil Engineers (ASCE)","Article","Final","","Scopus","2-s2.0-85137087468"
"Cui C.; Dong Z.; Luo Y.; Han Y.; Zhang T.","Cui, Can (58172333800); Dong, Zengchuan (23089899000); Luo, Yun (57210322756); Han, Yalei (57221869741); Zhang, Tianyan (57211444656)","58172333800; 23089899000; 57210322756; 57221869741; 57211444656","Lake Impoundment in Advance of Post-Flood Period Based on Large-Scale Numerical Simulation","2023","Journal of Water Resources Planning and Management","149","8","05023004","","","","0","10.1061/JWRMD5.WRENG-5811","https://www.scopus.com/inward/record.uri?eid=2-s2.0-85160616938&doi=10.1061%2fJWRMD5.WRENG-5811&partnerID=40&md5=54137ebb53a9435d6164b89e0aeb43cc","American Society of Civil Engineers (ASCE)","Article","Final","All Open Access; Hybrid Gold Open Access","Scopus","2-s2.0-85160616938"
"Chakraborty A.; Prakash O.","Chakraborty, Anirban (56437240100); Prakash, Om (57773872700)","56437240100; 57773872700","Identification of Clandestine Groundwater Pollution Sources in Aquifer Polluted with BTEX","2023","Journal of Water Resources Planning and Management","149","2","04022080","","","","0","10.1061/JWRMD5.WRENG-5078","https://www.scopus.com/inward/record.uri?eid=2-s2.0-85142930127&doi=10.1061%2fJWRMD5.WRENG-5078&partnerID=40&md5=9d2b08bab4c78b15d9086db81d7c88ab","American Society of Civil Engineers (ASCE)","Article","Final","","Scopus","2-s2.0-85142930127"
"Helseth A.; Melo A.C.G.; Ploussard Q.M.; Mo B.; Maceira M.E.P.; Botterud A.; Voisin N.","Helseth, Arild (24437969200); Melo, Albert C. G. (7102137965); Ploussard, Quentin M. (57194653469); Mo, Birger (7007052329); Maceira, Maria E. P. (8383876100); Botterud, Audun (23011593900); Voisin, Nathalie (6507150303)","24437969200; 7102137965; 57194653469; 7007052329; 8383876100; 23011593900; 6507150303","Hydropower Scheduling Toolchains: Comparing Experiences in Brazil, Norway, and USA and Implications for Synergistic Research","2023","Journal of Water Resources Planning and Management","149","7","04023030","","","","0","10.1061/JWRMD5.WRENG-5911","https://www.scopus.com/inward/record.uri?eid=2-s2.0-85159955902&doi=10.1061%2fJWRMD5.WRENG-5911&partnerID=40&md5=8073448dfc323138d50378a4e36727b4","American Society of Civil Engineers (ASCE)","Article","Final","","Scopus","2-s2.0-85159955902"
"Ma X.; Li Y.; Zhang W.; Li X.; Shi Z.; Yu J.; Wang J.; Liu J.","Ma, Xiaoyu (57929597200); Li, Yalin (57204555492); Zhang, Weiping (57193319887); Li, Xiujuan (57203866456); Shi, Zhiman (57929597300); Yu, Junfeng (57202905780); Wang, Jiangxia (57211092430); Liu, Jingqing (26662761400)","57929597200; 57204555492; 57193319887; 57203866456; 57929597300; 57202905780; 57211092430; 26662761400","A Real-Time Method to Detect the Leakage Location in Urban Water Distribution Networks","2022","Journal of Water Resources Planning and Management","148","12","04022069","","","","4","10.1061/(ASCE)WR.1943-5452.0001628","https://www.scopus.com/inward/record.uri?eid=2-s2.0-85139932069&doi=10.1061%2f%28ASCE%29WR.1943-5452.0001628&partnerID=40&md5=601d833612b4e56dbd6d9148bd8206f1","American Society of Civil Engineers (ASCE)","Article","Final","","Scopus","2-s2.0-85139932069"
"Richter B.D.","Richter, Brian D. (7101774925)","7101774925","Decoupling Urban Water Use from Population Growth in the Colorado River Basin","2023","Journal of Water Resources Planning and Management","149","2","04022082","","","","1","10.1061/JWRMD5.WRENG-5887","https://www.scopus.com/inward/record.uri?eid=2-s2.0-85144157535&doi=10.1061%2fJWRMD5.WRENG-5887&partnerID=40&md5=8c64ea23fda8b9ac5ca8c59df94d74b3","American Society of Civil Engineers (ASCE)","Article","Final","","Scopus","2-s2.0-85144157535"
"Bonazzi Sodek D.; Martim A.L.S.S.; Filho J.G.D.; Luvizotto E.","Bonazzi Sodek, Daniela (57927802400); Martim, André Luís Sotero Salustiano (57210377117); Filho, José Gilberto Dalfré (55347249800); Luvizotto, Edevar (6505901432)","57927802400; 57210377117; 55347249800; 6505901432","Pressure Reduction for Water Loss Management: A Statistical Evaluation of Water Consumption Considering Customer Storage Tanks","2022","Journal of Water Resources Planning and Management","148","12","06022004","","","","1","10.1061/(ASCE)WR.1943-5452.0001627","https://www.scopus.com/inward/record.uri?eid=2-s2.0-85139822893&doi=10.1061%2f%28ASCE%29WR.1943-5452.0001627&partnerID=40&md5=a411e4cbc133290046b30a9a9b8723f3","American Society of Civil Engineers (ASCE)","Article","Final","","Scopus","2-s2.0-85139822893"
"Wan X.; Farmani R.; Keedwell E.","Wan, Xi (57837606300); Farmani, Raziyeh (8585125300); Keedwell, Edward (8367205700)","57837606300; 8585125300; 8367205700","Gradual Leak Detection in Water Distribution Networks Based on Multistep Forecasting Strategy","2023","Journal of Water Resources Planning and Management","149","8","04023035-1","","","","0","10.1061/JWRMD5.WRENG-6001","https://www.scopus.com/inward/record.uri?eid=2-s2.0-85161209489&doi=10.1061%2fJWRMD5.WRENG-6001&partnerID=40&md5=5cf0f02119fbf2f5b026e2a481a019f4","American Society of Civil Engineers (ASCE)","Article","Final","All Open Access; Green Open Access","Scopus","2-s2.0-85161209489"
"Farghadan A.; Zamani M.S.; Ghazizadeh M.J.","Farghadan, Azim (57193745469); Zamani, Morteza Saheb (57204277696); Ghazizadeh, Mohammadreza Jalili (57194578759)","57193745469; 57204277696; 57194578759","Steady-State Hydraulic Analysis Based on Cellular Automata Using a Parallel Paradigm","2022","Journal of Water Resources Planning and Management","148","11","04022062","","","","0","10.1061/(ASCE)WR.1943-5452.0001621","https://www.scopus.com/inward/record.uri?eid=2-s2.0-85138401553&doi=10.1061%2f%28ASCE%29WR.1943-5452.0001621&partnerID=40&md5=cd2c6b96739a5b89cd96d1d6e52304f5","American Society of Civil Engineers (ASCE)","Article","Final","","Scopus","2-s2.0-85138401553"
"Josey B.M.; Buchberger S.G.; Gong J.","Josey, Brendan M. (57963641000); Buchberger, Steven G. (7004042155); Gong, Jinzhe (55355613100)","57963641000; 7004042155; 55355613100","Comparing Actual and Designed Water Demand in Australian Multilevel Residential Buildings","2023","Journal of Water Resources Planning and Management","149","1","05022013","","","","0","10.1061/(ASCE)WR.1943-5452.0001625","https://www.scopus.com/inward/record.uri?eid=2-s2.0-85141835279&doi=10.1061%2f%28ASCE%29WR.1943-5452.0001625&partnerID=40&md5=3366e2b96a2ee6b2cff3062ee38660f0","American Society of Civil Engineers (ASCE)","Article","Final","","Scopus","2-s2.0-85141835279"
"Vrachimis S.G.; Eliades D.G.; Taormina R.; Kapelan Z.; Ostfeld A.; Liu S.; Kyriakou M.; Pavlou P.; Qiu M.; Polycarpou M.M.","Vrachimis, Stelios G. (56521514700); Eliades, Demetrios G. (15057672400); Taormina, Riccardo (36609357000); Kapelan, Zoran (8273940200); Ostfeld, Avi (7005595203); Liu, Shuming (23097654600); Kyriakou, Marios (25928467500); Pavlou, Pavlos (57213759254); Qiu, Mengning (57204832780); Polycarpou, Marios M. (7006251578)","56521514700; 15057672400; 36609357000; 8273940200; 7005595203; 23097654600; 25928467500; 57213759254; 57204832780; 7006251578","Battle of the Leakage Detection and Isolation Methods","2022","Journal of Water Resources Planning and Management","148","12","04022068","","","","9","10.1061/(ASCE)WR.1943-5452.0001601","https://www.scopus.com/inward/record.uri?eid=2-s2.0-85139119152&doi=10.1061%2f%28ASCE%29WR.1943-5452.0001601&partnerID=40&md5=7718b98880002a0c20f0ab5afefa1043","American Society of Civil Engineers (ASCE)","Article","Final","All Open Access; Green Open Access","Scopus","2-s2.0-85139119152"
"Wang J.; Rosenberg D.E.","Wang, Jian (57728303400); Rosenberg, David E. (8577634300)","57728303400; 8577634300","Adapting Colorado River Basin Depletions to Available Water to Live within Our Means","2023","Journal of Water Resources Planning and Management","149","7","04023026","","","","0","10.1061/JWRMD5.WRENG-5555","https://www.scopus.com/inward/record.uri?eid=2-s2.0-85159486755&doi=10.1061%2fJWRMD5.WRENG-5555&partnerID=40&md5=46bc7ec4e71aa1b5df891c9d86890ac6","American Society of Civil Engineers (ASCE)","Article","Final","All Open Access; Green Open Access; Hybrid Gold Open Access","Scopus","2-s2.0-85159486755"
"Marks N.K.; Hosseiny H., Ph.d.; Bill V.P.; Ahn K.L.; Crimmins M.C.; Kremer P., Ph.d.; Smith V.B., Ph.d., A.m.asce","Marks, Nicole K. (57869321500); Hosseiny, Hossein (57196052555); Bill, Victoria P. (57870070900); Ahn, Kirsten L. (57869624400); Crimmins, Michael C. (57211207739); Kremer, Peleg (55796631300); Smith, Virginia B. (37084039400)","57869321500; 57196052555; 57870070900; 57869624400; 57211207739; 55796631300; 37084039400","Spatial Integration of Urban Runoff Modeling, Heat, and Social Vulnerability for Blue-Green Infrastructure Planning and Management","2022","Journal of Water Resources Planning and Management","148","11","05022007-1","","","","0","10.1061/(ASCE)WR.1943-5452.0001593","https://www.scopus.com/inward/record.uri?eid=2-s2.0-85137101601&doi=10.1061%2f%28ASCE%29WR.1943-5452.0001593&partnerID=40&md5=6d916052cf24e3ebd1fee4770aacc455","American Society of Civil Engineers (ASCE)","Article","Final","","Scopus","2-s2.0-85137101601"
"Duan Y.; Zhou S.; He J.; Bai M.","Duan, Yeqing (57694985700); Zhou, Shenbei (23479032500); He, Jiangping (57892529000); Bai, Minghao (56608683100)","57694985700; 23479032500; 57892529000; 56608683100","Effects of Permanent and Temporary Water-Right Payments on Balancing Agricultural and Ecological Interests: A Case Study of Hami Prefecture in Northwestern China","2022","Journal of Water Resources Planning and Management","148","11","04022058-1","","","","0","10.1061/(ASCE)WR.1943-5452.0001620","https://www.scopus.com/inward/record.uri?eid=2-s2.0-85138217102&doi=10.1061%2f%28ASCE%29WR.1943-5452.0001620&partnerID=40&md5=35ec8b6c694e2a56db0236ba86fb0124","American Society of Civil Engineers (ASCE)","Article","Final","","Scopus","2-s2.0-85138217102"
"Rapp A.H.; Capener A.M.; Sowby R.B.","Rapp, Alyson H. (58260844200); Capener, Annelise M. (58170655900); Sowby, Robert B. (56736830000)","58260844200; 58170655900; 56736830000","Adoption of Artificial Intelligence in Drinking Water Operations: A Survey of Progress in the United States","2023","Journal of Water Resources Planning and Management","149","7","06023002","","","","0","10.1061/JWRMD5.WRENG-5870","https://www.scopus.com/inward/record.uri?eid=2-s2.0-85159679829&doi=10.1061%2fJWRMD5.WRENG-5870&partnerID=40&md5=7babcacbe16c84962200192db7b00f58","American Society of Civil Engineers (ASCE)","Article","Final","","Scopus","2-s2.0-85159679829"
"Grigg N.S.","Grigg, Neil S. (7005653169)","7005653169","How State Governments Plan and Integrate Water Resources Management Programs","2023","Journal of Water Resources Planning and Management","149","3","04023001","","","","1","10.1061/JWRMD5.WRENG-5925","https://www.scopus.com/inward/record.uri?eid=2-s2.0-85145775947&doi=10.1061%2fJWRMD5.WRENG-5925&partnerID=40&md5=2cf364ebec1fdba44132b8ce9a03f566","American Society of Civil Engineers (ASCE)","Article","Final","","Scopus","2-s2.0-85145775947"
"Cao R.; Feng P.; Han Y.; Liu Z.; Huang X.; Li F.","Cao, Runxiang (56818473300); Feng, Ping (55638059500); Han, Yuping (8861913200); Liu, Zhongpei (35210594800); Huang, Xiaodong (57211002555); Li, Fawen (18234145800)","56818473300; 55638059500; 8861913200; 35210594800; 57211002555; 18234145800","A Flood-Attenuating Impervious Surface Layout Planning Framework: Integrated Storm Water Management Model with Harmony Search","2023","Journal of Water Resources Planning and Management","149","7","04023025","","","","0","10.1061/JWRMD5.WRENG-5988","https://www.scopus.com/inward/record.uri?eid=2-s2.0-85159064377&doi=10.1061%2fJWRMD5.WRENG-5988&partnerID=40&md5=3a6dc36400d74917b78229d4e5cdbdcc","American Society of Civil Engineers (ASCE)","Article","Final","","Scopus","2-s2.0-85159064377"
"Xiong F.; Xie Y.; Guo S.; Li Y.; Yin J.; Li N.","Xiong, Feng (57194522971); Xie, Yuzuo (57280282800); Guo, Shenglian (57203905671); Li, Yanqing (57431025700); Yin, Jiabo (57188711722); Li, Na (57320424300)","57194522971; 57280282800; 57203905671; 57431025700; 57188711722; 57320424300","Equivalent Relationship between Flood Prevention Storage of Cascade Reservoirs in the Downstream Jinsha River and Three Gorges Reservoir","2023","Journal of Water Resources Planning and Management","149","8","05023005","","","","0","10.1061/JWRMD5.WRENG-5710","https://www.scopus.com/inward/record.uri?eid=2-s2.0-85161443706&doi=10.1061%2fJWRMD5.WRENG-5710&partnerID=40&md5=c87f52f088fb29928614dd6a81a7c040","American Society of Civil Engineers (ASCE)","Article","Final","","Scopus","2-s2.0-85161443706"
"Yang G.; Giuliani M.; Galelli S.","Yang, Guang (57219653441); Giuliani, Matteo (55037435700); Galelli, Stefano (33567777500)","57219653441; 55037435700; 33567777500","Valuing the Codesign of Streamflow Forecast and Reservoir Operation Models","2023","Journal of Water Resources Planning and Management","149","8","04023037","","","","0","10.1061/JWRMD5.WRENG-6023","https://www.scopus.com/inward/record.uri?eid=2-s2.0-85161393436&doi=10.1061%2fJWRMD5.WRENG-6023&partnerID=40&md5=af22c3a4d217169def50a9e1aeadc541","American Society of Civil Engineers (ASCE)","Article","Final","","Scopus","2-s2.0-85161393436"
"Min K.W.; Kim T.; Lee S.; Choi Y.H.; Kim J.H.","Min, Kyoung Won (57212173655); Kim, Taewook (57220162996); Lee, Seungyub (57194627551); Choi, Young Hwan (56651350100); Kim, Joong Hoon (35100406500)","57212173655; 57220162996; 57194627551; 56651350100; 35100406500","Detecting and Localizing Leakages in Water Distribution Systems Using a Two-Phase Model","2022","Journal of Water Resources Planning and Management","148","10","04022051","","","","1","10.1061/(ASCE)WR.1943-5452.0001599","https://www.scopus.com/inward/record.uri?eid=2-s2.0-85137104664&doi=10.1061%2f%28ASCE%29WR.1943-5452.0001599&partnerID=40&md5=ee8a64d1c11673ddceb5bd78250d9f2e","American Society of Civil Engineers (ASCE)","Article","Final","","Scopus","2-s2.0-85137104664"
"Szeląg B.; Majerek D.; Kiczko A.; Łagód G.; Fatone F.; McGarity A.","Szeląg, Bartosz (55958697000); Majerek, Dariusz (8535647700); Kiczko, Adam (37090721000); Łagód, Grzegorz (22134887200); Fatone, Francesco (8585385700); McGarity, Arthur (6602172076)","55958697000; 8535647700; 37090721000; 22134887200; 8585385700; 6602172076","Analysis of Sewer Network Performance in the Context of Modernization: Modeling, Sensitivity, and Uncertainty Analysis","2022","Journal of Water Resources Planning and Management","148","12","04022066-1","","","","0","10.1061/(ASCE)WR.1943-5452.0001610","https://www.scopus.com/inward/record.uri?eid=2-s2.0-85139205780&doi=10.1061%2f%28ASCE%29WR.1943-5452.0001610&partnerID=40&md5=1568419702e1ede12b82ec09011f1887","American Society of Civil Engineers (ASCE)","Article","Final","","Scopus","2-s2.0-85139205780"
"Cole J.; Sharvelle S.; Arabi M.","Cole, Jeanne (57196473493); Sharvelle, Sybil (6507956765); Arabi, Mazdak (14520309600)","57196473493; 6507956765; 14520309600","Assessing Uncertainty in Multicriteria Evaluation of Centralized and Decentralized Dual Water Supply Strategies","2022","Journal of Water Resources Planning and Management","148","12","04022070","","","","2","10.1061/(ASCE)WR.1943-5452.0001572","https://www.scopus.com/inward/record.uri?eid=2-s2.0-85139837612&doi=10.1061%2f%28ASCE%29WR.1943-5452.0001572&partnerID=40&md5=ec0c000fd325c330c375862f36ee56c3","American Society of Civil Engineers (ASCE)","Article","Final","All Open Access; Hybrid Gold Open Access","Scopus","2-s2.0-85139837612"
"Jun S.; Lansey K.E.","Jun, Sanghoon (26655735600); Lansey, Kevin E. (7006358548)","26655735600; 7006358548","Linear Programming Models for Leak Detection and Localization in Water Distribution Networks","2023","Journal of Water Resources Planning and Management","149","5","04023017","","","","1","10.1061/JWRMD5.WRENG-5720","https://www.scopus.com/inward/record.uri?eid=2-s2.0-85150252550&doi=10.1061%2fJWRMD5.WRENG-5720&partnerID=40&md5=eeb34722e56a1b52f7b9e1b213a366c1","American Society of Civil Engineers (ASCE)","Article","Final","","Scopus","2-s2.0-85150252550"
"Ruiz E.; Díaz S.; González J.","Ruiz, Emilio (57548711800); Díaz, Sarai (57188870707); González, Javier (57193352394)","57548711800; 57188870707; 57193352394","Decomposed Uncertainty Evaluation for Hydraulic State Estimation in Water Supply Systems","2023","Journal of Water Resources Planning and Management","149","4","04023006","","","","0","10.1061/JWRMD5.WRENG-5924","https://www.scopus.com/inward/record.uri?eid=2-s2.0-85148108597&doi=10.1061%2fJWRMD5.WRENG-5924&partnerID=40&md5=75a333fd8b1d3fa32abb1b119e987b10","American Society of Civil Engineers (ASCE)","Article","Final","All Open Access; Green Open Access","Scopus","2-s2.0-85148108597"
"Yang E.; Butcher D.A.; Edwards M.A.; Faust K.M.","Yang, Euijin (57208507241); Butcher, Daniel A. (57939666200); Edwards, Marc A. (7402850883); Faust, Kasey M. (55803401200)","57208507241; 57939666200; 7402850883; 55803401200","Exploring the Relationship between Public Trust toward the Water Sector and the Use of Bottled Water within US Shrinking Cities","2023","Journal of Water Resources Planning and Management","149","1","04022071-1","","","","0","10.1061/(ASCE)WR.1943-5452.0001619","https://www.scopus.com/inward/record.uri?eid=2-s2.0-85140466842&doi=10.1061%2f%28ASCE%29WR.1943-5452.0001619&partnerID=40&md5=f5d7418bdcd50c4849be603d05c084ba","American Society of Civil Engineers (ASCE)","Article","Final","","Scopus","2-s2.0-85140466842"
"Shu F.; Liu H.; Fu G.; Sun S.; Li Y.; Ding W.; Wu J.; Zhou H.; Yuan Y.; He J.; Zhang L.","Shu, Fuzhi (58307451500); Liu, Haixing (44261289100); Fu, Guangtao (55499297600); Sun, Siao (55479101200); Li, Yu (36570524800); Ding, Wei (57967045600); Wu, Jian (58095898300); Zhou, Huicheng (7404742641); Yuan, Yongqin (57931486400); He, Junguo (58308539700); Zhang, Lingduo (57930907600)","58307451500; 44261289100; 55499297600; 55479101200; 36570524800; 57967045600; 58095898300; 7404742641; 57931486400; 58308539700; 57930907600","Unraveling the Impact of COVID-19 Pandemic Dynamics on Commercial Water-Use Variation","2023","Journal of Water Resources Planning and Management","149","8","04023036","","","","0","10.1061/JWRMD5.WRENG-5940","https://www.scopus.com/inward/record.uri?eid=2-s2.0-85161370872&doi=10.1061%2fJWRMD5.WRENG-5940&partnerID=40&md5=5c6b5fea0e2c9e128200d1652d67b1be","American Society of Civil Engineers (ASCE)","Article","Final","","Scopus","2-s2.0-85161370872"
"Lukk A.K.; Lusardi R.A.; Willis A.D.","Lukk, Amber K. (58126473400); Lusardi, Robert A. (25640288300); Willis, Ann D. (56126840600)","58126473400; 25640288300; 56126840600","Water Management for Conservation and Ecosystem Function: Modeling the Prioritization of Source Water in a Working Landscape","2023","Journal of Water Resources Planning and Management","149","5","04023011","","","","0","10.1061/JWRMD5.WRENG-5646","https://www.scopus.com/inward/record.uri?eid=2-s2.0-85149279133&doi=10.1061%2fJWRMD5.WRENG-5646&partnerID=40&md5=ee095e552c86f6ad3679aa290e2fc256","American Society of Civil Engineers (ASCE)","Article","Final","All Open Access; Hybrid Gold Open Access","Scopus","2-s2.0-85149279133"
"Hayelom A.; Ostfeld A.","Hayelom, Assefa (57773278700); Ostfeld, Avi (7005595203)","57773278700; 7005595203","Network Subsystems for Water Distribution System Optimization","2022","Journal of Water Resources Planning and Management","148","12","06022003","","","","1","10.1061/(ASCE)WR.1943-5452.0001629","https://www.scopus.com/inward/record.uri?eid=2-s2.0-85140230357&doi=10.1061%2f%28ASCE%29WR.1943-5452.0001629&partnerID=40&md5=37344b98a9f3f2a9f1bcf8b2a9504c24","American Society of Civil Engineers (ASCE)","Article","Final","","Scopus","2-s2.0-85140230357"
"McCoy A.L.; Pitt J.; Wilson J.K.; Martin S.; Morton J.","McCoy, Amy L. (16744055300); Pitt, Jennifer (35238275200); Wilson, J. Keaton (57225986933); Martin, Season (57200650811); Morton, Julia (57845261400)","16744055300; 35238275200; 57225986933; 57200650811; 57845261400","A Survey of the Bureau of Reclamation's Decree Accounting Reports in the Lower Colorado River Basin","2023","Journal of Water Resources Planning and Management","149","3","04022085","","","","0","10.1061/(ASCE)WR.1943-5452.0001626","https://www.scopus.com/inward/record.uri?eid=2-s2.0-85145171198&doi=10.1061%2f%28ASCE%29WR.1943-5452.0001626&partnerID=40&md5=f3d22d4655ffe54913ae45af228ea371","American Society of Civil Engineers (ASCE)","Article","Final","","Scopus","2-s2.0-85145171198"
"Burkhardt J.B.; Minor J.; Platten W.E.; Shang F.; Murray R.","Burkhardt, Jonathan B. (56710980300); Minor, John (58103494600); Platten, William E. (36473642700); Shang, Feng (7006110163); Murray, Regan (35409986100)","56710980300; 58103494600; 36473642700; 7006110163; 35409986100","Relative Water Age in Premise Plumbing Systems Using an Agent-Based Modeling Framework","2023","Journal of Water Resources Planning and Management","149","4","04023007","","","","0","10.1061/JWRMD5.WRENG-5888","https://www.scopus.com/inward/record.uri?eid=2-s2.0-85148054121&doi=10.1061%2fJWRMD5.WRENG-5888&partnerID=40&md5=0eb237303ab9147e17edca1f74b41090","American Society of Civil Engineers (ASCE)","Article","Final","","Scopus","2-s2.0-85148054121"
"Gong J.; Do N.C.; Lambert M.F.; Stephens M.L.; Cazzolato B.S.","Gong, Jinzhe (58005844000); Do, Nhu C. (55837383300); Lambert, Martin F. (24923543300); Stephens, Mark L. (8706283400); Cazzolato, Benjamin S. (6603538173)","58005844000; 55837383300; 24923543300; 8706283400; 6603538173","Enhancing Pipe-Break Early Warning in Smart Water Networks: Distinguishing Leaks from Water Uses","2023","Journal of Water Resources Planning and Management","149","7","06023003","","","","0","10.1061/JWRMD5.WRENG-6118","https://www.scopus.com/inward/record.uri?eid=2-s2.0-85159647843&doi=10.1061%2fJWRMD5.WRENG-6118&partnerID=40&md5=784ae1644465bc43c7fc5168bd362229","American Society of Civil Engineers (ASCE)","Article","Final","","Scopus","2-s2.0-85159647843"
"Bastidas Pacheco C.J.; Horsburgh J.S.; Attallah N.A.","Bastidas Pacheco, Camilo J. (57217671347); Horsburgh, Jeffery S. (22985191200); Attallah, Nour A. (57207033099)","57217671347; 22985191200; 57207033099","Variability in Consumption and End Uses of Water for Residential Users in Logan and Providence, Utah, US","2023","Journal of Water Resources Planning and Management","149","1","05022014","","","","3","10.1061/(ASCE)WR.1943-5452.0001633","https://www.scopus.com/inward/record.uri?eid=2-s2.0-85137413919&doi=10.1061%2f%28ASCE%29WR.1943-5452.0001633&partnerID=40&md5=00b4b9759919a1eab02efad622eac5d7","American Society of Civil Engineers (ASCE)","Article","Final","","Scopus","2-s2.0-85137413919"
