"Authors","Author full names","Author(s) ID","Title","Year","Source title","Volume","Issue","Art. No.","Page start","Page end","Page count","Cited by","DOI","Link","Publisher","Document Type","Publication Stage","Open Access","Source","EID"
"Zhang J.; Yang Y.-C.E.; Li H.; Shittu E.","Zhang, Jiaorui (57211121500); Yang, Yi-Chen Ethan (54785392800); Li, Hongyi (57206716460); Shittu, Ekundayo (13002705300)","57211121500; 54785392800; 57206716460; 13002705300","Examining the Food-Energy-Water-Environment Nexus in Transboundary River Basins through a Human Dimension Lens: Columbia River Basin","2021","Journal of Water Resources Planning and Management","147","10","05021019","","","","8","10.1061/(ASCE)WR.1943-5452.0001461","https://www.scopus.com/inward/record.uri?eid=2-s2.0-85112110020&doi=10.1061%2f%28ASCE%29WR.1943-5452.0001461&partnerID=40&md5=02601054d0a766e7a191cedd8416b3df","American Society of Civil Engineers (ASCE)","Article","Final","","Scopus","2-s2.0-85112110020"
"Zheng H.; Liu Y.; Langford J.; Zheng Z.","Zheng, Hang (55220304600); Liu, Yueyi (56098290500); Langford, John (56875723900); Zheng, Zhilei (57190668980)","55220304600; 56098290500; 56875723900; 57190668980","Water Supply Reliability of a Joint Rainwater Storage and On-Stream Reservoir System","2021","Journal of Water Resources Planning and Management","147","9","04021053","","","","1","10.1061/(ASCE)WR.1943-5452.0001411","https://www.scopus.com/inward/record.uri?eid=2-s2.0-85108962106&doi=10.1061%2f%28ASCE%29WR.1943-5452.0001411&partnerID=40&md5=0f06be580cb9bf41064906fd24952d44","American Society of Civil Engineers (ASCE)","Article","Final","","Scopus","2-s2.0-85108962106"
"Ozdemir O.N.; Buyruk T.; Ucaner E.","Ozdemir, Osman N. (7102426326); Buyruk, Tarik (57200219429); Ucaner, Erkan (16200351800)","7102426326; 57200219429; 16200351800","Calculation of Chlorine and Fluoride Diffusion/Dispersion Coefficients in Water Supply Pipes","2021","Journal of Water Resources Planning and Management","147","7","04021041","","","","4","10.1061/(ASCE)WR.1943-5452.0001396","https://www.scopus.com/inward/record.uri?eid=2-s2.0-85105881264&doi=10.1061%2f%28ASCE%29WR.1943-5452.0001396&partnerID=40&md5=68748a0ff7be73d6a15f3af63561059f","American Society of Civil Engineers (ASCE)","Article","Final","","Scopus","2-s2.0-85105881264"
"De Oliveira P.J.A.; Boccelli D.L.","De Oliveira, Paulo José A. (57198778700); Boccelli, Dominic L. (6602216194)","57198778700; 6602216194","Water Distribution Nodal Demand Clustering Based on Network Flow Measurements","2021","Journal of Water Resources Planning and Management","147","12","04021087","","","","0","10.1061/(ASCE)WR.1943-5452.0001485","https://www.scopus.com/inward/record.uri?eid=2-s2.0-85116862157&doi=10.1061%2f%28ASCE%29WR.1943-5452.0001485&partnerID=40&md5=ceac5ec4d5d8d4627d7ae39fe9098959","American Society of Civil Engineers (ASCE)","Article","Final","","Scopus","2-s2.0-85116862157"
"Zhang T.; Yao H.; Chu S.; Yu T.; Shao Y.","Zhang, Tuqiao (7404373750); Yao, Huaqi (57224761442); Chu, Shipeng (57196326647); Yu, Tingchao (8945378600); Shao, Yu (35761327400)","7404373750; 57224761442; 57196326647; 8945378600; 35761327400","Optimized DMA Partition to Reduce Background Leakage Rate in Water Distribution Networks","2021","Journal of Water Resources Planning and Management","147","10","04021071","","","","9","10.1061/(ASCE)WR.1943-5452.0001465","https://www.scopus.com/inward/record.uri?eid=2-s2.0-85112759589&doi=10.1061%2f%28ASCE%29WR.1943-5452.0001465&partnerID=40&md5=d01be33e156d9a41b90ac1cafb257a50","American Society of Civil Engineers (ASCE)","Article","Final","","Scopus","2-s2.0-85112759589"
"Waldron A.; Pecci F.; Stoianov I.","Waldron, Alexander (57219330749); Pecci, Filippo (56825733100); Stoianov, Ivan (23971798600)","57219330749; 56825733100; 23971798600","Closure to ""regularization of an inverse problem for parameter estimation in water distribution systems"" by alexander waldron, filippo pecci, and ivan stoianov","2021","Journal of Water Resources Planning and Management","147","12","07021021","","","","2","10.1061/(ASCE)WR.1943-5452.0001490","https://www.scopus.com/inward/record.uri?eid=2-s2.0-85117311029&doi=10.1061%2f%28ASCE%29WR.1943-5452.0001490&partnerID=40&md5=74cea5b1ced5e3ef1612bd00e95c7a56","American Society of Civil Engineers (ASCE)","Review","Final","","Scopus","2-s2.0-85117311029"
"Fontana N.; Marini G.","Fontana, Nicola (24721333100); Marini, Gustavo (23485764200)","24721333100; 23485764200","A Methodology to Assess Optimal Operation of a Prototype for Pressure Regulation and Hydropower Generation","2021","Journal of Water Resources Planning and Management","147","12","04021088","","","","1","10.1061/(ASCE)WR.1943-5452.0001475","https://www.scopus.com/inward/record.uri?eid=2-s2.0-85116868274&doi=10.1061%2f%28ASCE%29WR.1943-5452.0001475&partnerID=40&md5=211b7a0fe65a2ac0d5f102a6a934d165","American Society of Civil Engineers (ASCE)","Article","Final","","Scopus","2-s2.0-85116868274"
"Hamzekhani H.; Mousavi S.J.; Vesal M.","Hamzekhani, Hamed (57223979758); Mousavi, S. Jamshid (57220568233); Vesal, Mohammad (57200547474)","57223979758; 57220568233; 57200547474","Water-Energy Nexus-Based Economic Optimization of Water Supply Projects","2021","Journal of Water Resources Planning and Management","147","8","04021044","","","","1","10.1061/(ASCE)WR.1943-5452.0001376","https://www.scopus.com/inward/record.uri?eid=2-s2.0-85106638329&doi=10.1061%2f%28ASCE%29WR.1943-5452.0001376&partnerID=40&md5=3f3f96a1ee30526781ad0e7e4247043f","American Society of Civil Engineers (ASCE)","Article","Final","","Scopus","2-s2.0-85106638329"
"Zhang Z.; Qin H.; Yao L.; Liu Y.; Jiang Z.; Feng Z.; Ouyang S.; Pei S.; Zhou J.","Zhang, Zhendong (57206859237); Qin, Hui (7203032122); Yao, Liqiang (57207760682); Liu, Yongqi (57201467777); Jiang, Zhiqiang (56085025900); Feng, Zhongkai (48561032800); Ouyang, Shuo (55317174900); Pei, Shaoqian (57208261228); Zhou, Jianzhong (57230199000)","57206859237; 7203032122; 57207760682; 57201467777; 56085025900; 48561032800; 55317174900; 57208261228; 57230199000","Downstream Water Level Prediction of Reservoir based on Convolutional Neural Network and Long Short-Term Memory Network","2021","Journal of Water Resources Planning and Management","147","9","04021060","","","","7","10.1061/(ASCE)WR.1943-5452.0001432","https://www.scopus.com/inward/record.uri?eid=2-s2.0-85110421329&doi=10.1061%2f%28ASCE%29WR.1943-5452.0001432&partnerID=40&md5=bf04f3f6e80de6f0e55b64627defccd8","American Society of Civil Engineers (ASCE)","Article","Final","","Scopus","2-s2.0-85110421329"
"Kamal R.; Zhu D.Z.; Crossman J.A.; Leake A.","Kamal, Rajib (57190016034); Zhu, David Z. (7403598685); Crossman, James A. (36839100600); Leake, Alf (43261281300)","57190016034; 7403598685; 36839100600; 43261281300","A System Model for Total Dissolved Gas Risk Assessment Due to Multidam Spill Operations","2021","Journal of Water Resources Planning and Management","147","12","04021086","","","","2","10.1061/(ASCE)WR.1943-5452.0001487","https://www.scopus.com/inward/record.uri?eid=2-s2.0-85116265762&doi=10.1061%2f%28ASCE%29WR.1943-5452.0001487&partnerID=40&md5=b56151eff86fab8679b9005daa47a6bb","American Society of Civil Engineers (ASCE)","Article","Final","","Scopus","2-s2.0-85116265762"
"Burrow A.; Hering A.S.; Morton D.P.; Newman A.M.","Burrow, Andy (14824428900); Hering, Amanda S. (23767788800); Morton, David P. (7401545417); Newman, Alexandra M. (11439324600)","14824428900; 23767788800; 7401545417; 11439324600","Optimal Design and Operation of River Basin Storage under Hydroclimatic Uncertainty","2021","Journal of Water Resources Planning and Management","147","9","04021055","","","","1","10.1061/(ASCE)WR.1943-5452.0001337","https://www.scopus.com/inward/record.uri?eid=2-s2.0-85108946835&doi=10.1061%2f%28ASCE%29WR.1943-5452.0001337&partnerID=40&md5=812972b8b3948f7d06e02d7ec63808dc","American Society of Civil Engineers (ASCE)","Article","Final","","Scopus","2-s2.0-85108946835"
"Jia S.; Li D.","Jia, Shaofeng (7202859986); Li, Dalong (57211456144)","7202859986; 57211456144","Evolution of Water Governance in China","2021","Journal of Water Resources Planning and Management","147","8","04021050","","","","2","10.1061/(ASCE)WR.1943-5452.0001420","https://www.scopus.com/inward/record.uri?eid=2-s2.0-85107845862&doi=10.1061%2f%28ASCE%29WR.1943-5452.0001420&partnerID=40&md5=41e6680534f633c884600cb8da86e889","American Society of Civil Engineers (ASCE)","Article","Final","All Open Access; Hybrid Gold Open Access","Scopus","2-s2.0-85107845862"
"Ma Y.; Chang J.; Guo A.; Chen L.; Wang X.","Ma, Yongsheng (57218707382); Chang, Jianxia (9243607800); Guo, Aijun (56535974400); Chen, Lei (57192613286); Wang, Xuebin (57273403400)","57218707382; 9243607800; 56535974400; 57192613286; 57273403400","Conjunctive Operation of Interbasin Transferred Water and Local Water in a Multisource Diversion-Supply-Allocation System","2021","Journal of Water Resources Planning and Management","147","10","01426","","","","3","10.1061/(ASCE)WR.1943-5452.0001426","https://www.scopus.com/inward/record.uri?eid=2-s2.0-85111828488&doi=10.1061%2f%28ASCE%29WR.1943-5452.0001426&partnerID=40&md5=99dab126ab308b2f173fc171cac71a9d","American Society of Civil Engineers (ASCE)","Article","Final","","Scopus","2-s2.0-85111828488"
"Prasad R.K.; Parmar D.","Prasad, R.K. (57201124981); Parmar, Dipteek (23010269200)","57201124981; 23010269200","Discussion of ""effect of Pipe Size and Location on Water-Main Head Loss in Water Distribution Systems"" by Saeed Hashemi, Yves Filion, Vanessa Speight, and Andrew Long","2021","Journal of Water Resources Planning and Management","147","10","07021014","","","","1","10.1061/(ASCE)WR.1943-5452.0001459","https://www.scopus.com/inward/record.uri?eid=2-s2.0-85111577327&doi=10.1061%2f%28ASCE%29WR.1943-5452.0001459&partnerID=40&md5=622a30367d4d7125fee27988d850003d","American Society of Civil Engineers (ASCE)","Note","Final","","Scopus","2-s2.0-85111577327"
"Sowby R.B.","Sowby, Robert B. (56736830000)","56736830000","Discussion of ""effect of Pipe Size and Location on Water-Main Head Loss in Water Distribution Systems"" by Saeed Hashemi, Yves Filion, Vanessa Speight, and Andrew Long","2021","Journal of Water Resources Planning and Management","147","10","07021013","","","","0","10.1061/(ASCE)WR.1943-5452.0001458","https://www.scopus.com/inward/record.uri?eid=2-s2.0-85111421354&doi=10.1061%2f%28ASCE%29WR.1943-5452.0001458&partnerID=40&md5=cfab0f3ac73910ba3bbf05a6254a9ec5","American Society of Civil Engineers (ASCE)","Note","Final","","Scopus","2-s2.0-85111421354"
"Gibson J.; Karney B.","Gibson, John (56662305900); Karney, Bryan (7004449407)","56662305900; 7004449407","How Larger Lead Scale Particles are Likely to Move in Service Lines","2021","Journal of Water Resources Planning and Management","147","8","06021009","","","","0","10.1061/(ASCE)WR.1943-5452.0001427","https://www.scopus.com/inward/record.uri?eid=2-s2.0-85107316422&doi=10.1061%2f%28ASCE%29WR.1943-5452.0001427&partnerID=40&md5=289caf7e9e4cf47741c7fa19a1b36df2","American Society of Civil Engineers (ASCE)","Article","Final","","Scopus","2-s2.0-85107316422"
"Latifi M.; Farahi Moghadam K.; Naeeni S.T.","Latifi, Milad (57196067631); Farahi Moghadam, Kambiz (57223425166); Naeeni, Seyed Taghi (6506790781)","57196067631; 57223425166; 6506790781","Pressure and Energy Management in Water Distribution Networks through Optimal Use of Pump-As-Turbines along with Pressure-Reducing Valves","2021","Journal of Water Resources Planning and Management","147","7","04021039","","","","6","10.1061/(ASCE)WR.1943-5452.0001392","https://www.scopus.com/inward/record.uri?eid=2-s2.0-85105867104&doi=10.1061%2f%28ASCE%29WR.1943-5452.0001392&partnerID=40&md5=6df7384f4bc4b6ca6cb0ed5a1b78e585","American Society of Civil Engineers (ASCE)","Article","Final","","Scopus","2-s2.0-85105867104"
"Zhu M.; Wu F.; Shen J.; Bi F.","Zhu, Min (57208152098); Wu, Fengping (25637954700); Shen, Junyuan (57217583159); Bi, Fei (57225212318)","57208152098; 25637954700; 57217583159; 57225212318","Water Rights Trading Application to Water-Rich Regions in Southern China","2021","Journal of Water Resources Planning and Management","147","9","05021013","","","","1","10.1061/(ASCE)WR.1943-5452.0001435","https://www.scopus.com/inward/record.uri?eid=2-s2.0-85109523032&doi=10.1061%2f%28ASCE%29WR.1943-5452.0001435&partnerID=40&md5=c1f59a339c96fab1034a539018e19275","American Society of Civil Engineers (ASCE)","Article","Final","","Scopus","2-s2.0-85109523032"
"Wu Z.Y.; He Y.","Wu, Zheng Yi (26031765900); He, Yekun (57219558230)","26031765900; 57219558230","Time Series Data Decomposition-Based Anomaly Detection and Evaluation Framework for Operational Management of Smart Water Grid","2021","Journal of Water Resources Planning and Management","147","9","04021059","","","","8","10.1061/(ASCE)WR.1943-5452.0001433","https://www.scopus.com/inward/record.uri?eid=2-s2.0-85109535730&doi=10.1061%2f%28ASCE%29WR.1943-5452.0001433&partnerID=40&md5=ebd06961f44e1be582e40ac14b646638","American Society of Civil Engineers (ASCE)","Article","Final","","Scopus","2-s2.0-85109535730"
"Butcher J.B.","Butcher, Jonathan B. (7102431269)","7102431269","Storm Intensification: Implications for Environmental Design in Maryland","2021","Journal of Water Resources Planning and Management","147","10","04021073","","","","2","10.1061/(ASCE)WR.1943-5452.0001448","https://www.scopus.com/inward/record.uri?eid=2-s2.0-85112864634&doi=10.1061%2f%28ASCE%29WR.1943-5452.0001448&partnerID=40&md5=ddea6749a4037882ccabb7cdfa59270e","American Society of Civil Engineers (ASCE)","Article","Final","","Scopus","2-s2.0-85112864634"
"Zhao T.; Minsker B.; Spoelstra J.; Navarro C.; Lee J.","Zhao, Tingting (56331843500); Minsker, Barbara (6701548472); Spoelstra, Jacob (57207651348); Navarro, Christopher (24471615700); Lee, Jong (55635535600)","56331843500; 6701548472; 57207651348; 24471615700; 55635535600","Service-Driven Modeling Approach to Managing Water Allocation in Priority Doctrine Regions","2021","Journal of Water Resources Planning and Management","147","11","04021078","","","","0","10.1061/(ASCE)WR.1943-5452.0001463","https://www.scopus.com/inward/record.uri?eid=2-s2.0-85114374070&doi=10.1061%2f%28ASCE%29WR.1943-5452.0001463&partnerID=40&md5=d524c3bdb32a8c023a54c0b91b714005","American Society of Civil Engineers (ASCE)","Article","Final","","Scopus","2-s2.0-85114374070"
"Elhay S.; Piller O.; Deuerlein J.W.; Simpson A.R.","Elhay, Sylvan (6603023411); Piller, Olivier (23091947000); Deuerlein, Jochen W. (23972116900); Simpson, Angus R. (7402780493)","6603023411; 23091947000; 23972116900; 7402780493","An Interior Point Method Applied to Flow Constraints in a Pressure-Dependent Water Distribution System","2022","Journal of Water Resources Planning and Management","148","1","04021090","","","","2","10.1061/(ASCE)WR.1943-5452.0001484","https://www.scopus.com/inward/record.uri?eid=2-s2.0-85118212700&doi=10.1061%2f%28ASCE%29WR.1943-5452.0001484&partnerID=40&md5=99d58c4389266c411e21c4d458a9c8b4","American Society of Civil Engineers (ASCE)","Article","Final","","Scopus","2-s2.0-85118212700"
"Abokifa A.A.; Maheshwari A.; Gudi R.D.; Biswas P.","Abokifa, Ahmed A. (56979384600); Maheshwari, Abhilasha (57214534096); Gudi, Ravindra D. (7003356744); Biswas, Pratim (14031049800)","56979384600; 57214534096; 7003356744; 14031049800","Closure to ""influence of Dead-End Sections of Drinking Water Distribution Networks on Optimization of Booster Chlorination Systems"" by Ahmed A. Abokifa, Abhilasha Maheshwari, Ravindra D. Gudi, and Pratim Biswas","2021","Journal of Water Resources Planning and Management","147","11","07021016","","","","0","10.1061/(ASCE)WR.1943-5452.0001451","https://www.scopus.com/inward/record.uri?eid=2-s2.0-85113879260&doi=10.1061%2f%28ASCE%29WR.1943-5452.0001451&partnerID=40&md5=ef76f2b7bb448d2dd1d713facafcc8d5","American Society of Civil Engineers (ASCE)","Note","Final","","Scopus","2-s2.0-85113879260"
"Shang F.; Woo H.; Burkhardt J.B.; Murray R.","Shang, Feng (7006110163); Woo, Hyoungmin (57208864873); Burkhardt, Jonathan B. (56710980300); Murray, Regan (35409986100)","7006110163; 57208864873; 56710980300; 35409986100","Lagrangian Method to Model Advection-Dispersion-Reaction Transport in Drinking Water Pipe Networks","2021","Journal of Water Resources Planning and Management","147","9","04021057","","","","6","10.1061/(ASCE)WR.1943-5452.0001421","https://www.scopus.com/inward/record.uri?eid=2-s2.0-85109209106&doi=10.1061%2f%28ASCE%29WR.1943-5452.0001421&partnerID=40&md5=df5c2df1c702b86d575db40940517eda","American Society of Civil Engineers (ASCE)","Article","Final","All Open Access; Green Open Access","Scopus","2-s2.0-85109209106"
"Meyer D.; Ahadzadeh N.","Meyer, David (57224221392); Ahadzadeh, Negin (57216803715)","57224221392; 57216803715","Discussion of ""hydraulic Analysis of Intermittent Water-Distribution Networks Considering Partial-Flow Regimes"" by S. Mohan and G. R. Abhijith","2021","Journal of Water Resources Planning and Management","147","11","07021017","","","","1","10.1061/(ASCE)WR.1943-5452.0001466","https://www.scopus.com/inward/record.uri?eid=2-s2.0-85114516321&doi=10.1061%2f%28ASCE%29WR.1943-5452.0001466&partnerID=40&md5=4b74893dfe046fb30e5ddb0d3d618d8d","American Society of Civil Engineers (ASCE)","Short survey","Final","","Scopus","2-s2.0-85114516321"
"Grigg N.S.","Grigg, Neil S. (7005653169)","7005653169","One Water: How to Define, Explain, and Teach It","2021","Journal of Water Resources Planning and Management","147","8","02521005","","","","0","10.1061/(ASCE)WR.1943-5452.0001404","https://www.scopus.com/inward/record.uri?eid=2-s2.0-85106990977&doi=10.1061%2f%28ASCE%29WR.1943-5452.0001404&partnerID=40&md5=fea37ad9e46cfee5976d26981b79858c","American Society of Civil Engineers (ASCE)","Review","Final","","Scopus","2-s2.0-85106990977"
"Wang H.; Wanakule N.; Asefa T.","Wang, Hui (57218524336); Wanakule, Nisai (56619616000); Asefa, Tirusew (8404132000)","57218524336; 56619616000; 8404132000","Examining Effectiveness of Optimal Groundwater Management at Multiple Timescales in Tampa Bay Region","2021","Journal of Water Resources Planning and Management","147","12","04021085","","","","0","10.1061/(ASCE)WR.1943-5452.0001486","https://www.scopus.com/inward/record.uri?eid=2-s2.0-85116244715&doi=10.1061%2f%28ASCE%29WR.1943-5452.0001486&partnerID=40&md5=ad7d0b3a97954f9b9fb4e876f6b2a182","American Society of Civil Engineers (ASCE)","Article","Final","","Scopus","2-s2.0-85116244715"
"Lund J.R.","Lund, Jay R. (55950426300)","55950426300","Approaches to Planning Water Resources","2021","Journal of Water Resources Planning and Management","147","9","04021058","","","","3","10.1061/(ASCE)WR.1943-5452.0001417","https://www.scopus.com/inward/record.uri?eid=2-s2.0-85109400625&doi=10.1061%2f%28ASCE%29WR.1943-5452.0001417&partnerID=40&md5=bfe92e738c15277b972250854cb81588","American Society of Civil Engineers (ASCE)","Article","Final","All Open Access; Hybrid Gold Open Access","Scopus","2-s2.0-85109400625"
"Zeng W.; Zecchin A.C.; Cazzolato B.S.; Simpson A.R.; Gong J.; Lambert M.F.","Zeng, Wei (57211365328); Zecchin, Aaron C. (6506193289); Cazzolato, Benjamin S. (6603538173); Simpson, Angus R. (7402780493); Gong, Jinzhe (55355613100); Lambert, Martin F. (24923543300)","57211365328; 6506193289; 6603538173; 7402780493; 55355613100; 24923543300","Extremely Sensitive Anomaly Detection in Pipe Networks Using a Higher-Order Paired-Impulse Response Function with a Correlator","2021","Journal of Water Resources Planning and Management","147","10","04021068","","","","5","10.1061/(ASCE)WR.1943-5452.0001446","https://www.scopus.com/inward/record.uri?eid=2-s2.0-85112330467&doi=10.1061%2f%28ASCE%29WR.1943-5452.0001446&partnerID=40&md5=4f43f05f4e087a552240ae56caed182b","American Society of Civil Engineers (ASCE)","Article","Final","All Open Access; Hybrid Gold Open Access","Scopus","2-s2.0-85112330467"
"Yates D.; Mehta V.K.; Huber-Lee A.; McCluskey A.; Purkey D.","Yates, David (7103213245); Mehta, Vishal K. (7102296586); Huber-Lee, Annette (16678791900); McCluskey, Alyssa (7004402360); Purkey, David (6603305041)","7103213245; 7102296586; 16678791900; 7004402360; 6603305041","Exploring the Water-Energy Nexus in California via an Integrative Modeling Approach","2021","Journal of Water Resources Planning and Management","147","12","04021084","","","","0","10.1061/(ASCE)WR.1943-5452.0001431","https://www.scopus.com/inward/record.uri?eid=2-s2.0-85116497052&doi=10.1061%2f%28ASCE%29WR.1943-5452.0001431&partnerID=40&md5=7bb4856891e799c3125bdaa95a7fbf1e","American Society of Civil Engineers (ASCE)","Article","Final","All Open Access; Hybrid Gold Open Access","Scopus","2-s2.0-85116497052"
"Griffin J.M.","Griffin, James M. (55436266500)","55436266500","Efficiency Implications of Trading in a Bifurcated Market","2021","Journal of Water Resources Planning and Management","147","8","05021012","","","","0","10.1061/(ASCE)WR.1943-5452.0001418","https://www.scopus.com/inward/record.uri?eid=2-s2.0-85107634944&doi=10.1061%2f%28ASCE%29WR.1943-5452.0001418&partnerID=40&md5=172b19e5895ecd719f54937b7b043c25","American Society of Civil Engineers (ASCE)","Article","Final","","Scopus","2-s2.0-85107634944"
"Unruh H.; Habib E.H.; Borrok D.","Unruh, Hanz (57226530964); Habib, Emad H. (7005665474); Borrok, David (6507615486)","57226530964; 7005665474; 6507615486","Impacts of Hydraulic Fracturing on Surface and Groundwater Water Resources: Case Study from Louisiana","2021","Journal of Water Resources Planning and Management","147","10","1443","","","","1","10.1061/(ASCE)WR.1943-5452.0001443","https://www.scopus.com/inward/record.uri?eid=2-s2.0-85111869126&doi=10.1061%2f%28ASCE%29WR.1943-5452.0001443&partnerID=40&md5=3c9abf0bf4d12ee3cdcd8c6e758e73fc","American Society of Civil Engineers (ASCE)","Article","Final","","Scopus","2-s2.0-85111869126"
"Veena S.; Singh R.; Gold D.; Reed P.; Bhave A.","Veena, Sai (57238598400); Singh, Riddhi (56784644500); Gold, David (57211800828); Reed, Patrick (7202010819); Bhave, Ajay (55584569800)","57238598400; 56784644500; 57211800828; 7202010819; 55584569800","Improving Information-Based Coordinated Operations in Interbasin Water Transfer Megaprojects: Case Study in Southern India","2021","Journal of Water Resources Planning and Management","147","11","e0001456","","","","4","10.1061/(ASCE)WR.1943-5452.0001456","https://www.scopus.com/inward/record.uri?eid=2-s2.0-85113874487&doi=10.1061%2f%28ASCE%29WR.1943-5452.0001456&partnerID=40&md5=21b8a67136e95fc2d1b6ec4ab08168aa","American Society of Civil Engineers (ASCE)","Article","Final","","Scopus","2-s2.0-85113874487"
"Mahmoodzadeh D.; Karamouz M.","Mahmoodzadeh, Davood (55917889300); Karamouz, Mohammad (56243091200)","55917889300; 56243091200","A Hydroeconomic Simulation-Optimization Framework to Assess the Cooperative Game Theory in Coastal Groundwater Management","2022","Journal of Water Resources Planning and Management","148","1","04021092","","","","0","10.1061/(ASCE)WR.1943-5452.0001482","https://www.scopus.com/inward/record.uri?eid=2-s2.0-85118370204&doi=10.1061%2f%28ASCE%29WR.1943-5452.0001482&partnerID=40&md5=aa53c5dfd315a7a143c0a8309050ad7b","American Society of Civil Engineers (ASCE)","Article","Final","","Scopus","2-s2.0-85118370204"
"Mohammad Ashrafi S.","Mohammad Ashrafi, Seyed (47061051100)","47061051100","Two-Stage Metaheuristic Mixed Integer Nonlinear Programming Approach to Extract Optimum Hedging Rules for Multireservoir Systems","2021","Journal of Water Resources Planning and Management","147","10","04021070","","","","12","10.1061/(ASCE)WR.1943-5452.0001460","https://www.scopus.com/inward/record.uri?eid=2-s2.0-85112348124&doi=10.1061%2f%28ASCE%29WR.1943-5452.0001460&partnerID=40&md5=f60cb57f36dd6749ca361bb2e527068f","American Society of Civil Engineers (ASCE)","Article","Final","","Scopus","2-s2.0-85112348124"
"Sivakumar P.; Gorev N.B.; Tanyimboh T.T.; Kodzhespirova I.F.; Suribabu C.R.; Neelakantan T.R.","Sivakumar, P. (55266030000); Gorev, Nikolai B. (7007026723); Tanyimboh, Tiku T. (6603247597); Kodzhespirova, Inna F. (6603223371); Suribabu, C.R. (14822610500); Neelakantan, T.R. (6603051022)","55266030000; 7007026723; 6603247597; 6603223371; 14822610500; 6603051022","Closure to ""dynamic Pressure-Dependent Simulation of Water Distribution Networks Considering Volume-Driven Demands Based on Noniterative Application of EPANET 2"" by P. Sivakumar, Nikolai B. Gorev, Tiku T. Tanyimboh, Inna F. Kodzhespirova, C. R. Suribabu, and T. R. Neelakantan","2021","Journal of Water Resources Planning and Management","147","8","1429","","","","0","10.1061/(ASCE)WR.1943-5452.0001429","https://www.scopus.com/inward/record.uri?eid=2-s2.0-85107276689&doi=10.1061%2f%28ASCE%29WR.1943-5452.0001429&partnerID=40&md5=3a633454d7f6ac1ecdc4bb9c215e7e4d","American Society of Civil Engineers (ASCE)","Note","Final","","Scopus","2-s2.0-85107276689"
"Dau Q.V.; Adeloye A.J.","Dau, Quan V. (57193064902); Adeloye, Adebayo J. (7007175362)","57193064902; 7007175362","Influence of Reservoir Joint Operation on Performance of the Pong-Bhakra Multipurpose, Multireservoir System in Northern India","2021","Journal of Water Resources Planning and Management","147","11","04021076","","","","4","10.1061/(ASCE)WR.1943-5452.0001462","https://www.scopus.com/inward/record.uri?eid=2-s2.0-85113892071&doi=10.1061%2f%28ASCE%29WR.1943-5452.0001462&partnerID=40&md5=18ef23f08820fff7d6aec6425cbe6f46","American Society of Civil Engineers (ASCE)","Article","Final","","Scopus","2-s2.0-85113892071"
