"Authors","Author full names","Author(s) ID","Title","Year","Source title","Volume","Issue","Art. No.","Page start","Page end","Page count","Cited by","DOI","Link","Publisher","Document Type","Publication Stage","Open Access","Source","EID"
"Yang E.; Faust K.M.","Yang, Euijin (57208507241); Faust, Kasey M. (55803401200)","57208507241; 55803401200","Human-Water Infrastructure Interactions: Substituting Services Received for Bottled and Filtered Water in US Shrinking Cities","2019","Journal of Water Resources Planning and Management","145","12","04019056","","","","9","10.1061/(ASCE)WR.1943-5452.0001126","https://www.scopus.com/inward/record.uri?eid=2-s2.0-85072947461&doi=10.1061%2f%28ASCE%29WR.1943-5452.0001126&partnerID=40&md5=20166884f335e0685eb15e1056ceda44","American Society of Civil Engineers (ASCE)","Article","Final","","Scopus","2-s2.0-85072947461"
"Lin Z.; Lim S.H.; Lin T.; Borders M.","Lin, Zhulu (7404229823); Lim, Siew Hoon (23489696000); Lin, Tong (57197734519); Borders, Michael (57211487689)","7404229823; 23489696000; 57197734519; 57211487689","Using Agent-Based Modeling for Water Resources Management in the Bakken Region","2020","Journal of Water Resources Planning and Management","146","1","05019020","","","","9","10.1061/(ASCE)WR.1943-5452.0001147","https://www.scopus.com/inward/record.uri?eid=2-s2.0-85074158533&doi=10.1061%2f%28ASCE%29WR.1943-5452.0001147&partnerID=40&md5=7ffb2f31da7b64832fb56df479c61bb2","American Society of Civil Engineers (ASCE)","Article","Final","","Scopus","2-s2.0-85074158533"
"Giustolisi O.","Giustolisi, Orazio (13907989600)","13907989600","Water Distribution Network Reliability Assessment and Isolation Valve System","2020","Journal of Water Resources Planning and Management","146","1","04019064","","","","31","10.1061/(ASCE)WR.1943-5452.0001128","https://www.scopus.com/inward/record.uri?eid=2-s2.0-85074134466&doi=10.1061%2f%28ASCE%29WR.1943-5452.0001128&partnerID=40&md5=dc4c174bbdecda10aee8e78cc28b0128","American Society of Civil Engineers (ASCE)","Article","Final","","Scopus","2-s2.0-85074134466"
"Rai S.P.; Sharma N.; Wolf A.T.","Rai, Subash P. (56385018300); Sharma, Nayan (13408226700); Wolf, Aaron T. (7403173984)","56385018300; 13408226700; 7403173984","Perceived Risk of Cooperation between India and Nepal on the Kosi River","2019","Journal of Water Resources Planning and Management","145","9","05019012","","","","1","10.1061/(ASCE)WR.1943-5452.0001102","https://www.scopus.com/inward/record.uri?eid=2-s2.0-85067668781&doi=10.1061%2f%28ASCE%29WR.1943-5452.0001102&partnerID=40&md5=768e65842c639cfff81c6bc6e05581b5","American Society of Civil Engineers (ASCE)","Article","Final","","Scopus","2-s2.0-85067668781"
"Varzi M.M.; Grigg N.; Asce F.","Varzi, Manijeh Mahmoudzadeh (57203753049); Grigg, Neil (7005653169); Asce, F. (57210304503)","57203753049; 7005653169; 57210304503","Overcoming obstacles to deficit irrigation: Colorado case study","2019","Journal of Water Resources Planning and Management","145","10","05019014","","","","4","10.1061/(ASCE)WR.1943-5452.0001107","https://www.scopus.com/inward/record.uri?eid=2-s2.0-85069782222&doi=10.1061%2f%28ASCE%29WR.1943-5452.0001107&partnerID=40&md5=3526b7bb957a6b73471d0be34a4f5a76","American Society of Civil Engineers (ASCE)","Article","Final","","Scopus","2-s2.0-85069782222"
"Wang J.; Cheng C.; Wu X.; Shen J.; Cao R.","Wang, Jian (57728303400); Cheng, Chuntian (7404796475); Wu, Xinyu (36086770400); Shen, Jianjian (45261490200); Cao, Rui (57194651773)","57728303400; 7404796475; 36086770400; 45261490200; 57194651773","Optimal hedging for hydropower operation and end-of-year carryover storage values","2019","Journal of Water Resources Planning and Management","145","4","04019003","","","","18","10.1061/(ASCE)WR.1943-5452.0001046","https://www.scopus.com/inward/record.uri?eid=2-s2.0-85060755732&doi=10.1061%2f%28ASCE%29WR.1943-5452.0001046&partnerID=40&md5=9b36f0e445c64599f0508d9fd57f74b8","American Society of Civil Engineers (ASCE)","Article","Final","","Scopus","2-s2.0-85060755732"
"Morris C.R.; Stewardson M.J.; Finlayson B.L.; Godden L.C.","Morris, C.R. (57204059837); Stewardson, M.J. (6506521533); Finlayson, B.L. (7101742180); Godden, L.C. (30467733600)","57204059837; 6506521533; 7101742180; 30467733600","Managing cumulative effects of farm dams in southeastern Australia","2019","Journal of Water Resources Planning and Management","145","3","05019003","","","","5","10.1061/(ASCE)WR.1943-5452.0001041","https://www.scopus.com/inward/record.uri?eid=2-s2.0-85059939528&doi=10.1061%2f%28ASCE%29WR.1943-5452.0001041&partnerID=40&md5=0b8e59519b91255ae5d82d3d17de2645","American Society of Civil Engineers (ASCE)","Article","Final","","Scopus","2-s2.0-85059939528"
"Qin T.; Boccelli D.L.","Qin, Tian (56145172700); Boccelli, Dominic L. (6602216194)","56145172700; 6602216194","Estimating Distribution System Water Demands Using Markov Chain Monte Carlo","2019","Journal of Water Resources Planning and Management","145","7","04019023","","","","15","10.1061/(ASCE)WR.1943-5452.0001077","https://www.scopus.com/inward/record.uri?eid=2-s2.0-85065244662&doi=10.1061%2f%28ASCE%29WR.1943-5452.0001077&partnerID=40&md5=0dfd38e03c9b272ab3b91b75fd2a54d0","American Society of Civil Engineers (ASCE)","Article","Final","","Scopus","2-s2.0-85065244662"
"Jeong G.; Kang D.","Jeong, Gimoon (57194229819); Kang, Doosun (35069822100)","57194229819; 35069822100","Closure to ""Revisiting the resilience index for water distribution networks"" by Gimoon Jeong, Albert Wicaksono, and Doosun Kang","2019","Journal of Water Resources Planning and Management","145","1","07018010","","","","0","10.1061/(ASCE)WR.1943-5452.0000792","https://www.scopus.com/inward/record.uri?eid=2-s2.0-85055439883&doi=10.1061%2f%28ASCE%29WR.1943-5452.0000792&partnerID=40&md5=cdc7894561c794e44288f913d1952f06","American Society of Civil Engineers (ASCE)","Note","Final","","Scopus","2-s2.0-85055439883"
"Zeff H.; Kaczan D.; Characklis G.W.; Jeuland M.; Murray B.; Locklier K.","Zeff, Harrison (55815991900); Kaczan, David (36657328200); Characklis, Gregory W. (6603397589); Jeuland, Marc (16039523000); Murray, Brian (56999175200); Locklier, Katie (57196319251)","55815991900; 36657328200; 6603397589; 16039523000; 56999175200; 57196319251","Potential Implications of Groundwater Trading and Reformed Water Rights in Diamond Valley, Nevada","2019","Journal of Water Resources Planning and Management","145","6","05019009","","","","5","10.1061/(ASCE)WR.1943-5452.0001032","https://www.scopus.com/inward/record.uri?eid=2-s2.0-85063510800&doi=10.1061%2f%28ASCE%29WR.1943-5452.0001032&partnerID=40&md5=2924fc1405a9378060bae733e81f920d","American Society of Civil Engineers (ASCE)","Article","Final","","Scopus","2-s2.0-85063510800"
"Ngo T.T.; Jung D.; Kim J.H.","Ngo, Thuy Thi (56954433700); Jung, Donghwi (55263904900); Kim, Joong Hoon (35100406500)","56954433700; 55263904900; 35100406500","Robust Urban Drainage System: Development of a Novel Multiscenario-Based Design Approach","2019","Journal of Water Resources Planning and Management","145","7","04019027","","","","5","10.1061/(ASCE)WR.1943-5452.0001084","https://www.scopus.com/inward/record.uri?eid=2-s2.0-85065720004&doi=10.1061%2f%28ASCE%29WR.1943-5452.0001084&partnerID=40&md5=b12275f6bf455c13392743039ad5182b","American Society of Civil Engineers (ASCE)","Article","Final","","Scopus","2-s2.0-85065720004"
"van Ginkel K.C.H.; Hoekstra A.Y.; Buurman J.; Hogeboom R.J.","van Ginkel, Kees C.H. (57202385773); Hoekstra, Arjen Y. (7007050344); Buurman, Joost (6603958852); Hogeboom, Rick J. (55660827700)","57202385773; 7007050344; 6603958852; 55660827700","Urban water security dashboard: Systems approach to characterizing the water security of cities","2018","Journal of Water Resources Planning and Management","144","12","04018075","","","","32","10.1061/(ASCE)WR.1943-5452.0000997","https://www.scopus.com/inward/record.uri?eid=2-s2.0-85054017979&doi=10.1061%2f%28ASCE%29WR.1943-5452.0000997&partnerID=40&md5=f049d921e506081c8d709bbb1bfc7aff","American Society of Civil Engineers (ASCE)","Article","Final","All Open Access; Green Open Access; Hybrid Gold Open Access","Scopus","2-s2.0-85054017979"
"Andrade I.; Cruz C.O.; Sarmento J.M.","Andrade, Isabel (57213736298); Cruz, Carlos Oliveira (58077187200); Sarmento, Joaquim Miranda (57125842800)","57213736298; 58077187200; 57125842800","Renegotiations of water concessions: Empirical analysis of main determinants","2018","Journal of Water Resources Planning and Management","144","11","04018073","","","","8","10.1061/(ASCE)WR.1943-5452.0000999","https://www.scopus.com/inward/record.uri?eid=2-s2.0-85053288299&doi=10.1061%2f%28ASCE%29WR.1943-5452.0000999&partnerID=40&md5=ad95a855928ebc0dc3f623aebf2b177d","American Society of Civil Engineers (ASCE)","Article","Final","","Scopus","2-s2.0-85053288299"
"Du K.; Ding R.-Y.; Wang Z.-H.; Song Z.-G.; Xu B.-F.; Zhou M.; Bai Y.; Zhang J.","Du, Kun (55778036200); Ding, Rong-Yi (57201856003); Wang, Zhi-Hao (57192441315); Song, Zhi-Gang (41961674400); Xu, Bing-Feng (55898778500); Zhou, Ming (57198736335); Bai, Yun (55461096500); Zhang, Jin (56276628400)","55778036200; 57201856003; 57192441315; 41961674400; 55898778500; 57198736335; 55461096500; 56276628400","Erratum: Direct inversion algorithm for pipe resistance coefficient calibration of water distribution systems [DOI: 10.1061/(ASCE)WR.1943-5452.0000948]","2018","Journal of Water Resources Planning and Management","144","10","08218001","","","","6","10.1061/(ASCE)WR.1943-5452.0000948","https://www.scopus.com/inward/record.uri?eid=2-s2.0-85050998471&doi=10.1061%2f%28ASCE%29WR.1943-5452.0000948&partnerID=40&md5=83fb1cf53a56af366144299d23dd7c5b","American Society of Civil Engineers (ASCE)","Erratum","Final","","Scopus","2-s2.0-85050998471"
"García I.F.; Ferras D.; Nabola A.M.","García, Irene Fernández (55617503300); Ferras, David (56411907400); Nabola, Aonghus Mc (57205332275)","55617503300; 56411907400; 57205332275","Potential of energy recovery and water saving using micro-hydropower in rural water distribution networks","2019","Journal of Water Resources Planning and Management","145","3","05019001","","","","14","10.1061/(ASCE)WR.1943-5452.0001045","https://www.scopus.com/inward/record.uri?eid=2-s2.0-85059590421&doi=10.1061%2f%28ASCE%29WR.1943-5452.0001045&partnerID=40&md5=007e3a0def11a76590152fa812deafa3","American Society of Civil Engineers (ASCE)","Article","Final","","Scopus","2-s2.0-85059590421"
"Alexander S.; Wu S.; Block P.","Alexander, Sarah (57206894663); Wu, Shu (55495117900); Block, Paul (17342246300)","57206894663; 55495117900; 17342246300","Model Selection Based on Sectoral Application Scale for Increased Value of Hydroclimate-Prediction Information","2019","Journal of Water Resources Planning and Management","145","5","04019006","","","","14","10.1061/(ASCE)WR.1943-5452.0001044","https://www.scopus.com/inward/record.uri?eid=2-s2.0-85062087152&doi=10.1061%2f%28ASCE%29WR.1943-5452.0001044&partnerID=40&md5=3e03a5984ed7515ead75c1d0e9d3e777","American Society of Civil Engineers (ASCE)","Article","Final","","Scopus","2-s2.0-85062087152"
"Wu X.; Li S.; Cheng C.; Miao S.; Ying Q.","Wu, Xinyu (36086770400); Li, Shuming (57207110683); Cheng, Chuntian (7404796475); Miao, Shumin (56709279300); Ying, Qilin (57207114096)","36086770400; 57207110683; 7404796475; 56709279300; 57207114096","Simulation-Optimization Model to Derive Operation Rules of Multiple Cascaded Reservoirs for Nash Equilibrium","2019","Journal of Water Resources Planning and Management","145","5","04019013","","","","10","10.1061/(ASCE)WR.1943-5452.0001057","https://www.scopus.com/inward/record.uri?eid=2-s2.0-85062225083&doi=10.1061%2f%28ASCE%29WR.1943-5452.0001057&partnerID=40&md5=18746a9c799a864aaf1ec117d1224106","American Society of Civil Engineers (ASCE)","Article","Final","","Scopus","2-s2.0-85062225083"
"Molinos-Senante M.; Maziotis A.; Sala-Garrido R.","Molinos-Senante, María (35765339200); Maziotis, Alexandros (57204311254); Sala-Garrido, Ramon (57127751300)","35765339200; 57204311254; 57127751300","Estimating Profit, Price, and Productivity Changes in Water Industry Using Bennet-Bowley Indicator","2019","Journal of Water Resources Planning and Management","145","5","04019011","","","","8","10.1061/(ASCE)WR.1943-5452.0001065","https://www.scopus.com/inward/record.uri?eid=2-s2.0-85062206302&doi=10.1061%2f%28ASCE%29WR.1943-5452.0001065&partnerID=40&md5=056bf8649fb7ebf64bf90d572907583c","American Society of Civil Engineers (ASCE)","Article","Final","","Scopus","2-s2.0-85062206302"
"Pecci F.; Abraham E.; Stoianov I.","Pecci, Filippo (56825733100); Abraham, Edo (57254673500); Stoianov, Ivan (23971798600)","56825733100; 57254673500; 23971798600","Model Reduction and Outer Approximation for Optimizing the Placement of Control Valves in Complex Water Networks","2019","Journal of Water Resources Planning and Management","145","5","04019014","","","","16","10.1061/(ASCE)WR.1943-5452.0001055","https://www.scopus.com/inward/record.uri?eid=2-s2.0-85062211875&doi=10.1061%2f%28ASCE%29WR.1943-5452.0001055&partnerID=40&md5=d8d60c561376667ce7dc9cd98164e7ae","American Society of Civil Engineers (ASCE)","Article","Final","All Open Access; Green Open Access","Scopus","2-s2.0-85062211875"
"Jeong G.; Kang D.","Jeong, Gimoon (57194229819); Kang, Doosun (35069822100)","57194229819; 35069822100","Erratum: Revisiting the resilience index for water distribution networks [J. Water Resour. Plann. Manage.] DOI: 10.1061/(ASCE)WR.1943-5452.0000792","2019","Journal of Water Resources Planning and Management","145","1","08218002","","","","0","10.1061/(ASCE)WR.1943-5452.0000792","https://www.scopus.com/inward/record.uri?eid=2-s2.0-85057921405&doi=10.1061%2f%28ASCE%29WR.1943-5452.0000792&partnerID=40&md5=9e34ba8fd187439e09bf96832139e58b","American Society of Civil Engineers (ASCE)","Erratum","Final","","Scopus","2-s2.0-85057921405"
"Komarulzaman A.; De Jong E.; Smits J.","Komarulzaman, Ahmad (57056483100); De Jong, Eelke (7103304836); Smits, Jeroen (7101673888)","57056483100; 7103304836; 7101673888","Hidden Water Affordability Problems Revealed in Developing Countries","2019","Journal of Water Resources Planning and Management","145","4","05019006","","","","10","10.1061/(ASCE)WR.1943-5452.0001051","https://www.scopus.com/inward/record.uri?eid=2-s2.0-85061384990&doi=10.1061%2f%28ASCE%29WR.1943-5452.0001051&partnerID=40&md5=750078f732285acb6b7e0574fadc29f6","American Society of Civil Engineers (ASCE)","Article","Final","","Scopus","2-s2.0-85061384990"
"Lund J.; Medellin-Azuara J.; Durand J.; Stone K.","Lund, Jay (55950426300); Medellin-Azuara, Josue (19934190600); Durand, John (56135982000); Stone, Kathleen (57203182667)","55950426300; 19934190600; 56135982000; 57203182667","Lessons from California's 2012-2016 drought","2018","Journal of Water Resources Planning and Management","144","10","04018067","","","","156","10.1061/(ASCE)WR.1943-5452.0000984","https://www.scopus.com/inward/record.uri?eid=2-s2.0-85050864061&doi=10.1061%2f%28ASCE%29WR.1943-5452.0000984&partnerID=40&md5=46b92a18bfac7e6f3eb232419e4a475e","American Society of Civil Engineers (ASCE)","Article","Final","All Open Access; Hybrid Gold Open Access","Scopus","2-s2.0-85050864061"
"Maimone M.; Malter S.; Rockwell J.; Raj V.","Maimone, M. (36840429100); Malter, S. (57194646941); Rockwell, J. (57194652356); Raj, V. (57203534917)","36840429100; 57194646941; 57194652356; 57203534917","Transforming Global Climate Model Precipitation Output for Use in Urban Stormwater Applications","2019","Journal of Water Resources Planning and Management","145","6","04019021","","","","7","10.1061/(ASCE)WR.1943-5452.0001071","https://www.scopus.com/inward/record.uri?eid=2-s2.0-85063508398&doi=10.1061%2f%28ASCE%29WR.1943-5452.0001071&partnerID=40&md5=76387e11ecd4096a093a03244a5510d8","American Society of Civil Engineers (ASCE)","Article","Final","","Scopus","2-s2.0-85063508398"
"Geng Z.; Hu X.; Han Y.; Zhong Y.","Geng, Zhiqiang (8976561200); Hu, Xuan (57203001068); Han, Yongming (55489232400); Zhong, Yanhua (54390658200)","8976561200; 57203001068; 55489232400; 54390658200","A novel leakage-detection method based on sensitivity matrix of pipe flow: Case study of water distribution systems","2019","Journal of Water Resources Planning and Management","145","2","04018094","","","","22","10.1061/(ASCE)WR.1943-5452.0001025","https://www.scopus.com/inward/record.uri?eid=2-s2.0-85057869813&doi=10.1061%2f%28ASCE%29WR.1943-5452.0001025&partnerID=40&md5=d4934c0c74b7f591766a283e55414fc1","American Society of Civil Engineers (ASCE)","Article","Final","","Scopus","2-s2.0-85057869813"
"Balekelayi N.; Tesfamariam S.","Balekelayi, Ngandu (57208867795); Tesfamariam, Solomon (8264664200)","57208867795; 8264664200","Graph-Theoretic Surrogate Measure to Analyze Reliability of Water Distribution System Using Bayesian Belief Network-Based Data Fusion Technique","2019","Journal of Water Resources Planning and Management","145","8","04019028","","","","16","10.1061/(ASCE)WR.1943-5452.0001087","https://www.scopus.com/inward/record.uri?eid=2-s2.0-85065997052&doi=10.1061%2f%28ASCE%29WR.1943-5452.0001087&partnerID=40&md5=1fd600fbc33bd57ef14e3b47946856b3","American Society of Civil Engineers (ASCE)","Article","Final","","Scopus","2-s2.0-85065997052"
"Peters C.N.; Baroud H.; Hornberger G.M.","Peters, Chelsea N. (57194392592); Baroud, Hiba (55974499500); Hornberger, George M. (7005737153)","57194392592; 55974499500; 7005737153","Multicriteria decision analysis of drinking water source selection in southwestern Bangladesh","2019","Journal of Water Resources Planning and Management","145","4","05019004","","","","18","10.1061/(ASCE)WR.1943- 5452.0001029","https://www.scopus.com/inward/record.uri?eid=2-s2.0-85058158541&doi=10.1061%2f%28ASCE%29WR.1943-+5452.0001029&partnerID=40&md5=d6067b819b133038b199b125519e7f46","American Society of Civil Engineers (ASCE)","Article","Final","","Scopus","2-s2.0-85058158541"
"Hill D.J.; Babbar-Sebens M.","Hill, David J. (57202519688); Babbar-Sebens, Meghna (25521149700)","57202519688; 25521149700","Promise of UAV-Assisted Adaptive Management of Water Resources Systems","2019","Journal of Water Resources Planning and Management","145","7","02519001","","","","6","10.1061/(ASCE)WR.1943-5452.0001081","https://www.scopus.com/inward/record.uri?eid=2-s2.0-85064949825&doi=10.1061%2f%28ASCE%29WR.1943-5452.0001081&partnerID=40&md5=b179cec3114fbc48452a556824e195e4","American Society of Civil Engineers (ASCE)","Article","Final","","Scopus","2-s2.0-85064949825"
"Cabrera E.; Gómez E.; Soriano J.; Del Teso R.","Cabrera, E. (7006129633); Gómez, E. (56825071900); Soriano, J. (55184010400); Del Teso, R. (57203007994)","7006129633; 56825071900; 55184010400; 57203007994","Eco-Layouts in water distribution systems","2019","Journal of Water Resources Planning and Management","145","1","04018088","","","","10","10.1061/(ASCE) WR.1943-5452.0001024","https://www.scopus.com/inward/record.uri?eid=2-s2.0-85056571581&doi=10.1061%2f%28ASCE%29+WR.1943-5452.0001024&partnerID=40&md5=c9dcd3976c4ae31dc9d021e9d72f4939","American Society of Civil Engineers (ASCE)","Article","Final","All Open Access; Green Open Access","Scopus","2-s2.0-85056571581"
"Stwertka C.H.; Titus A.J.; Albert M.R.; White K.D.","Stwertka, Carolyn H. (26427822500); Titus, Alexander J. (57190819141); Albert, Mary R. (7403276577); White, Kathleen D. (7402809869)","26427822500; 57190819141; 7403276577; 7402809869","Automated strategic prioritization matchmaking tool to facilitate federal-community adaptation implementation","2018","Journal of Water Resources Planning and Management","144","12","04018081","","","","0","10.1061/(ASCE)WR.1943-5452.0000994","https://www.scopus.com/inward/record.uri?eid=2-s2.0-85054970776&doi=10.1061%2f%28ASCE%29WR.1943-5452.0000994&partnerID=40&md5=158f7aea605a1c7de8e1353aa608150a","American Society of Civil Engineers (ASCE)","Article","Final","","Scopus","2-s2.0-85054970776"
"Woodward J.; Stoughton K.M.; Begley L.; Boyd B.","Woodward, James (57193532370); Stoughton, Katherine McMordie (55347952300); Begley, Loida (35175705800); Boyd, Brian (57204706375)","57193532370; 55347952300; 35175705800; 57204706375","Evaluating water assets using water efficiency framework for infrastructure intensive agency","2019","Journal of Water Resources Planning and Management","145","2","04018090","","","","6","10.1061/(ASCE)WR.1943-5452.0001016","https://www.scopus.com/inward/record.uri?eid=2-s2.0-85056794473&doi=10.1061%2f%28ASCE%29WR.1943-5452.0001016&partnerID=40&md5=cf116fc1272b4e2f189573c3adc1b484","American Society of Civil Engineers (ASCE)","Article","Final","","Scopus","2-s2.0-85056794473"
"Fontana N.; Giugni M.; Glielmo L.; Marini G.; Zollo R.","Fontana, N. (24721333100); Giugni, M. (6602833850); Glielmo, L. (6603819476); Marini, G. (23485764200); Zollo, R. (57200034341)","24721333100; 6602833850; 6603819476; 23485764200; 57200034341","Hydraulic and electric regulation of a prototype for real-time control of pressure and hydropower generation in a water distribution network","2018","Journal of Water Resources Planning and Management","144","11","04018072","","","","15","10.1061/(ASCE)WR.1943-5452.0001004","https://www.scopus.com/inward/record.uri?eid=2-s2.0-85053264657&doi=10.1061%2f%28ASCE%29WR.1943-5452.0001004&partnerID=40&md5=20750bc890f5ec3ccecc7de53de42146","American Society of Civil Engineers (ASCE)","Article","Final","","Scopus","2-s2.0-85053264657"
"Fluixá-Sanmartín J.; Altarejos-García L.; Morales-Torres A.; Escuder-Bueno I.","Fluixá-Sanmartín, Javier (55956706700); Altarejos-García, Luis (40461072400); Morales-Torres, Adrián (54963844600); Escuder-Bueno, Ignacio (36085974500)","55956706700; 40461072400; 54963844600; 36085974500","Empirical tool for the assessment of annual overtopping probabilities of dams","2019","Journal of Water Resources Planning and Management","145","1","04018083","","","","9","10.1061/(ASCE)WR.1943-5452.0001017","https://www.scopus.com/inward/record.uri?eid=2-s2.0-85055503332&doi=10.1061%2f%28ASCE%29WR.1943-5452.0001017&partnerID=40&md5=71809f3f5179080ef55caeebeb2f85d5","American Society of Civil Engineers (ASCE)","Article","Final","","Scopus","2-s2.0-85055503332"
"Karamouz M.; Taheri M.; Khalili P.; Chen X.","Karamouz, M. (56243091200); Taheri, M. (57212595642); Khalili, P. (57205664366); Chen, X. (57056609200)","56243091200; 57212595642; 57205664366; 57056609200","Building infrastructure resilience in coastal flood risk management","2019","Journal of Water Resources Planning and Management","145","4","04019004","","","","28","10.1061/(ASCE)WR.1943-5452.0001043","https://www.scopus.com/inward/record.uri?eid=2-s2.0-85061007131&doi=10.1061%2f%28ASCE%29WR.1943-5452.0001043&partnerID=40&md5=ed839745005f1154df4730c7c5e23631","American Society of Civil Engineers (ASCE)","Article","Final","","Scopus","2-s2.0-85061007131"
"Cabrera E.; Gómez E.; Del Teso R.; Estruch M.E.","Cabrera, E. (7006129633); Gómez, E. (56825071900); Del Teso, R. (57203007994); Estruch, M.E. (57204397683)","7006129633; 56825071900; 57203007994; 57204397683","Discussion of ""Revisiting the resilience index for water distribution networks"" by Gimoon Jeong, Albert Wicaksono, and Doosun Kang","2019","Journal of Water Resources Planning and Management","145","1","07018009","","","","1","10.1061/(ASCE)WR.1943-5452.0000792","https://www.scopus.com/inward/record.uri?eid=2-s2.0-85055414640&doi=10.1061%2f%28ASCE%29WR.1943-5452.0000792&partnerID=40&md5=103d12c01a78c32638a2ec45a9406286","American Society of Civil Engineers (ASCE)","Note","Final","","Scopus","2-s2.0-85055414640"
"Ticehurst J.L.; Curtis A.L.","Ticehurst, Jenifer L. (8596209300); Curtis, Allan L. (57192894049)","8596209300; 57192894049","Assessing Conjunctive Use Opportunities with Stakeholders in the Murray-Darling Basin, Australia","2019","Journal of Water Resources Planning and Management","145","5","05019008","","","","5","10.1061/(ASCE)WR.1943-5452.0001069","https://www.scopus.com/inward/record.uri?eid=2-s2.0-85062699060&doi=10.1061%2f%28ASCE%29WR.1943-5452.0001069&partnerID=40&md5=7cf3dcc6c835780d0629aa682f05277f","American Society of Civil Engineers (ASCE)","Article","Final","","Scopus","2-s2.0-85062699060"
"Zhang Z.; Lei X.; Tian Y.; Wang L.; Wang H.; Su K.","Zhang, Zhao (57193280486); Lei, Xiaohui (15760501200); Tian, Yu (35390223100); Wang, Lingling (57188963611); Wang, Hao (36619287400); Su, Kunpeng (57208595472)","57193280486; 15760501200; 35390223100; 57188963611; 36619287400; 57208595472","Optimized Scheduling of Cascade Pumping Stations in Open-Channel Water Transfer Systems Based on Station Skipping","2019","Journal of Water Resources Planning and Management","145","7","05019011","","","","13","10.1061/(ASCE)WR.1943-5452.0001080","https://www.scopus.com/inward/record.uri?eid=2-s2.0-85065247494&doi=10.1061%2f%28ASCE%29WR.1943-5452.0001080&partnerID=40&md5=ff29cdb3f7b52e495d9c2922ddd47691","American Society of Civil Engineers (ASCE)","Article","Final","","Scopus","2-s2.0-85065247494"
"Hecht J.S.; Kirshen P.H.","Hecht, Jory S. (43261550100); Kirshen, Paul H. (7003600114)","43261550100; 7003600114","Minimizing urban floodplain management regrets under deeply uncertain climate change","2019","Journal of Water Resources Planning and Management","145","2","04018096","","","","4","10.1061/(ASCE)WR.1943-5452.0001012","https://www.scopus.com/inward/record.uri?eid=2-s2.0-85058208782&doi=10.1061%2f%28ASCE%29WR.1943-5452.0001012&partnerID=40&md5=727555c844aa365695b17aa5416639ff","American Society of Civil Engineers (ASCE)","Article","Final","","Scopus","2-s2.0-85058208782"
