"Authors","Author full names","Author(s) ID","Title","Year","Source title","Volume","Issue","Art. No.","Page start","Page end","Page count","Cited by","DOI","Link","Publisher","Document Type","Publication Stage","Open Access","Source","EID"
"Pesantez J.E.; Berglund E.Z.; Mahinthakumar G.","Pesantez, Jorge E. (57209307038); Berglund, Emily Zechman (56394090200); Mahinthakumar, G. (6602708612)","57209307038; 56394090200; 6602708612","Geospatial and Hydraulic Simulation to Design District Metered Areas for Large Water Distribution Networks","2020","Journal of Water Resources Planning and Management","146","7","06020010","","","","8","10.1061/(ASCE)WR.1943-5452.0001243","https://www.scopus.com/inward/record.uri?eid=2-s2.0-85084927309&doi=10.1061%2f%28ASCE%29WR.1943-5452.0001243&partnerID=40&md5=70a6646c6159d99b0b585b870794d086","American Society of Civil Engineers (ASCE)","Article","Final","","Scopus","2-s2.0-85084927309"
"Paez D.; Filion Y.; Castro-Gama M.; Quintiliani C.; Santopietro S.; Sweetapple C.; Meng F.; Farmani R.; Fu G.; Butler D.; Zhang Q.; Zheng F.; Diao K.; Ulanicki B.; Huang Y.; Deuerlein J.; Gilbert D.; Abraham E.; Piller O.; Bałut A.; Brodziak R.; Bylka J.; Zakrzewski P.; Li Y.; Gao J.; Jian C.; Ou C.; Hu S.; Sophocleous S.; Nikoloudi E.; Mahmoud H.; Woodward K.; Romano M.; Santonastaso G.F.; Creaco E.; Di Nardo A.; Di Natale M.; Bibok A.; Salcedo C.; Aguilar A.; Cuero P.; González S.; Muñoz S.; Pérez J.; Posada A.; Robles J.; Vargas K.; Franchini M.; Galelli S.; Kim J.H.; Iglesias-Rey P.; Kapelan Z.; Saldarriaga J.; Savic D.; Walski T.","Paez, Diego (55837204200); Filion, Yves (6603123029); Castro-Gama, Mario (56083465500); Quintiliani, Claudia (56826126600); Santopietro, Simone (57192178639); Sweetapple, Chris (55765221800); Meng, Fanlin (57189492952); Farmani, Raziyeh (8585125300); Fu, Guangtao (55499297600); Butler, David (55603464200); Zhang, Qingzhou (55649831800); Zheng, Feifei (57204893325); Diao, Kegong (35223166800); Ulanicki, Bogumil (6602135774); Huang, Yuan (55650708200); Deuerlein, Jochen (23972116900); Gilbert, Denis (56260232300); Abraham, Edo (57254673500); Piller, Olivier (23091947000); Bałut, Alicja (46061185700); Brodziak, Rafał (56111852300); Bylka, Jȩdrzej (56922242600); Zakrzewski, Przemysław (57188814141); Li, Yuanzhe (57212459963); Gao, Jinliang (8895826300); Jian, Cai (57196018274); Ou, Chenhao (57218949943); Hu, Shiyuan (57218957320); Sophocleous, Sophocles (56825913200); Nikoloudi, Eirini (57218461643); Mahmoud, Herman (57194159444); Woodward, Kevin (55190875000); Romano, Michele (55837776700); Santonastaso, Giovanni Francesco (55336890100); Creaco, Enrico (56037591400); Di Nardo, Armando (7004537402); Di Natale, Michele (7006960625); Bibok, Attila (57216915919); Salcedo, Camilo (56521293300); Aguilar, Andrés (57218956862); Cuero, Paula (55837364900); González, Sebastián (57206419105); Muñoz, Sergio (57218953163); Pérez, Jorge (57207052761); Posada, Alejandra (57218953884); Robles, Juliana (57202606145); Vargas, Kevin (57209305152); Franchini, Marco (7103375106); Galelli, Stefano (33567777500); Kim, Joong Hoon (35100406500); Iglesias-Rey, Pedro (15220062200); Kapelan, Zoran (8273940200); Saldarriaga, Juan (23092053200); Savic, Dragan (35580202000); Walski, Thomas (35270422800)","55837204200; 6603123029; 56083465500; 56826126600; 57192178639; 55765221800; 57189492952; 8585125300; 55499297600; 55603464200; 55649831800; 57204893325; 35223166800; 6602135774; 55650708200; 23972116900; 56260232300; 57254673500; 23091947000; 46061185700; 56111852300; 56922242600; 57188814141; 57212459963; 8895826300; 57196018274; 57218949943; 57218957320; 56825913200; 57218461643; 57194159444; 55190875000; 55837776700; 55336890100; 56037591400; 7004537402; 7006960625; 57216915919; 56521293300; 57218956862; 55837364900; 57206419105; 57218953163; 57207052761; 57218953884; 57202606145; 57209305152; 7103375106; 33567777500; 35100406500; 15220062200; 8273940200; 23092053200; 35580202000; 35270422800","Battle of Postdisaster Response and Restoration","2020","Journal of Water Resources Planning and Management","146","8","04020067","","","","15","10.1061/(ASCE)WR.1943-5452.0001239","https://www.scopus.com/inward/record.uri?eid=2-s2.0-85090909434&doi=10.1061%2f%28ASCE%29WR.1943-5452.0001239&partnerID=40&md5=dda41d7d486302bea7d64bad816a0972","American Society of Civil Engineers (ASCE)","Article","Final","All Open Access; Green Open Access","Scopus","2-s2.0-85090909434"
"Liu Y.; Barrows C.; Macknick J.; Mauter M.","Liu, Yang (57200419102); Barrows, Clayton (35218804300); Macknick, Jordan (26536228100); Mauter, Meagan (24598019300)","57200419102; 35218804300; 26536228100; 24598019300","Optimization Framework to Assess the Demand Response Capacity of a Water Distribution System","2020","Journal of Water Resources Planning and Management","146","8","04020063","","","","11","10.1061/(ASCE)WR.1943-5452.0001258","https://www.scopus.com/inward/record.uri?eid=2-s2.0-85083588424&doi=10.1061%2f%28ASCE%29WR.1943-5452.0001258&partnerID=40&md5=e0f62a41f71faf281e9549dbb3f11f4f","American Society of Civil Engineers (ASCE)","Article","Final","All Open Access; Green Open Access","Scopus","2-s2.0-85083588424"
"Balekelayi N.; Tesfamariam S.","Balekelayi, Ngandu (57208867795); Tesfamariam, Solomon (8264664200)","57208867795; 8264664200","Closure to ""graph-Theoretic Surrogate Measure to Analyze Reliability of Water Distribution System Using Bayesian Belief Network-Based Data Fusion Technique"" by Ngandu Balekelayi and Solomon Tesfamariam","2020","Journal of Water Resources Planning and Management","146","8","07020002","","","","0","10.1061/(ASCE)WR.1943-5452.0001271","https://www.scopus.com/inward/record.uri?eid=2-s2.0-85085873253&doi=10.1061%2f%28ASCE%29WR.1943-5452.0001271&partnerID=40&md5=74632fdeb30b57478ef579b5303c6568","American Society of Civil Engineers (ASCE)","Note","Final","","Scopus","2-s2.0-85085873253"
"Reid Bell A.; Ward P.S.; Ashfaq M.; Davies S.","Reid Bell, Andrew (18533255100); Ward, Patrick S. (55827731800); Ashfaq, Muhammad (58252089500); Davies, Stephen (8360393200)","18533255100; 55827731800; 58252089500; 8360393200","Valuation and Aspirations for Drip Irrigation in Punjab, Pakistan","2020","Journal of Water Resources Planning and Management","146","6","04020035","","","","5","10.1061/(ASCE)WR.1943-5452.0001181","https://www.scopus.com/inward/record.uri?eid=2-s2.0-85083074338&doi=10.1061%2f%28ASCE%29WR.1943-5452.0001181&partnerID=40&md5=0ff2173e7baae49b431eda4de8d1d4e3","American Society of Civil Engineers (ASCE)","Article","Final","All Open Access; Hybrid Gold Open Access","Scopus","2-s2.0-85083074338"
"Ferrante M.; Bosco C.; Ugarelli R.; Magenta L.; Eidsmo T.","Ferrante, Marco (7006631622); Bosco, Camillo (24479603700); Ugarelli, Rita (23478410700); Magenta, Lorenzo (57216130234); Eidsmo, Tomas (57216129730)","7006631622; 24479603700; 23478410700; 57216130234; 57216129730","Mass, Energy, and Cost Balances in Water Distribution Systems with PATs: The Trondheim Network Case Study","2020","Journal of Water Resources Planning and Management","146","5","1201","","","","9","10.1061/(ASCE)WR.1943-5452.0001201","https://www.scopus.com/inward/record.uri?eid=2-s2.0-85082609919&doi=10.1061%2f%28ASCE%29WR.1943-5452.0001201&partnerID=40&md5=1b1df8c31926edcfd3b97469d1fb4dd5","American Society of Civil Engineers (ASCE)","Article","Final","","Scopus","2-s2.0-85082609919"
"Deng J.; Li Y.; Xu B.; Ding W.; Zhou H.; Schmidt A.","Deng, Jiahui (56701466400); Li, Yu (36570524800); Xu, Bo (57194513328); Ding, Wei (56701589000); Zhou, Huicheng (7404742641); Schmidt, Arthur (55537979200)","56701466400; 36570524800; 57194513328; 56701589000; 7404742641; 55537979200","Ecological Optimal Operation of Hydropower Stations to Maximize Total Phosphorus Export","2020","Journal of Water Resources Planning and Management","146","9","04020075","","","","7","10.1061/(ASCE)WR.1943-5452.0001275","https://www.scopus.com/inward/record.uri?eid=2-s2.0-85087179133&doi=10.1061%2f%28ASCE%29WR.1943-5452.0001275&partnerID=40&md5=a52db1c303ab8698ed046aba6e6f343c","American Society of Civil Engineers (ASCE)","Article","Final","","Scopus","2-s2.0-85087179133"
"Foglianti G.; Alvisi S.; Franchini M.; Todini E.","Foglianti, Gioia (57216933734); Alvisi, Stefano (55996164000); Franchini, Marco (7103375106); Todini, Ezio (57203775170)","57216933734; 55996164000; 7103375106; 57203775170","Extending the Global-Gradient Algorithm to Solve Pressure-Control Valves","2020","Journal of Water Resources Planning and Management","146","8","04020055","","","","6","10.1061/(ASCE)WR.1943-5452.0001247","https://www.scopus.com/inward/record.uri?eid=2-s2.0-85085361540&doi=10.1061%2f%28ASCE%29WR.1943-5452.0001247&partnerID=40&md5=9716f4c530c84c117907ca58036ff9f5","American Society of Civil Engineers (ASCE)","Article","Final","","Scopus","2-s2.0-85085361540"
"Robinson S.C.","Robinson, Samuel Collin (57216704005)","57216704005","Well-Induced Stream Depletion and Groundwater Return Flow: Estimating Impact Schedules with a Finite-Difference Spreadsheet","2020","Journal of Water Resources Planning and Management","146","7","06020009","","","","1","10.1061/(ASCE)WR.1943-5452.0001230","https://www.scopus.com/inward/record.uri?eid=2-s2.0-85084335699&doi=10.1061%2f%28ASCE%29WR.1943-5452.0001230&partnerID=40&md5=9bc370c3be051345784ed5ba52d321e1","American Society of Civil Engineers (ASCE)","Article","Final","All Open Access; Hybrid Gold Open Access","Scopus","2-s2.0-85084335699"
"Zia A.; Ding S.; Messer K.D.; Miao H.; Suter J.F.; Fooks J.R.; Guilfoos T.; Trandafir S.; Uchida E.; Tsai Y.; Merrill S.; Turnbull S.; Koliba C.","Zia, Asim (57223446194); Ding, Shanshan (56008858900); Messer, Kent D. (10042680100); Miao, Haoran (57189003658); Suter, Jordan F. (7006458428); Fooks, Jacob R. (55218351600); Guilfoos, Todd (55841204300); Trandafir, Simona (57188994282); Uchida, Emi (8586829500); Tsai, Yushiou (7402628025); Merrill, Scott (23028387200); Turnbull, Scott (57192383887); Koliba, Christopher (10040358800)","57223446194; 56008858900; 10042680100; 57189003658; 7006458428; 55218351600; 55841204300; 57188994282; 8586829500; 7402628025; 23028387200; 57192383887; 10040358800","Characterizing Heterogeneous Behavior of Non-Point-Source Polluters in a Spatial Game under Alternate Sensing and Incentive Designs","2020","Journal of Water Resources Planning and Management","146","8","04020054","","","","3","10.1061/(ASCE)WR.1943-5452.0001242","https://www.scopus.com/inward/record.uri?eid=2-s2.0-85085567830&doi=10.1061%2f%28ASCE%29WR.1943-5452.0001242&partnerID=40&md5=3a09c78cfc5ccb71bd53a4ce9129a801","American Society of Civil Engineers (ASCE)","Article","Final","All Open Access; Green Open Access; Hybrid Gold Open Access","Scopus","2-s2.0-85085567830"
"Avisse N.; Tilmant A.; Rosenberg D.; Talozi S.","Avisse, Nicolas (57192700967); Tilmant, Amaury (15822801300); Rosenberg, David (8577634300); Talozi, Samer (6508223235)","57192700967; 15822801300; 8577634300; 6508223235","Quantitative Assessment of Contested Water Uses and Management in the Conflict-Torn Yarmouk River Basin","2020","Journal of Water Resources Planning and Management","146","7","05020010","","","","7","10.1061/(ASCE)WR.1943-5452.0001240","https://www.scopus.com/inward/record.uri?eid=2-s2.0-85084647780&doi=10.1061%2f%28ASCE%29WR.1943-5452.0001240&partnerID=40&md5=8f614d6b3428f4245f70380d521ec88c","American Society of Civil Engineers (ASCE)","Article","Final","All Open Access; Green Open Access","Scopus","2-s2.0-85084647780"
"Wang X.; Lin J.; Ghidaoui M.S.","Wang, Xun (55873101700); Lin, Jingrong (57205720677); Ghidaoui, Mohamed S. (6701589992)","55873101700; 57205720677; 6701589992","Usage and Effect of Multiple Transient Tests for Pipeline Leak Detection","2020","Journal of Water Resources Planning and Management","146","11","06020011","","","","27","10.1061/(ASCE)WR.1943-5452.0001284","https://www.scopus.com/inward/record.uri?eid=2-s2.0-85082846303&doi=10.1061%2f%28ASCE%29WR.1943-5452.0001284&partnerID=40&md5=314f61aaaefaa539aa1629ffa7ee41e7","American Society of Civil Engineers (ASCE)","Article","Final","","Scopus","2-s2.0-85082846303"
"Pecci F.; Parpas P.; Stoianov I.","Pecci, Filippo (56825733100); Parpas, Panos (22953851000); Stoianov, Ivan (23971798600)","56825733100; 22953851000; 23971798600","Sequential Convex Optimization for Detecting and Locating Blockages in Water Distribution Networks","2020","Journal of Water Resources Planning and Management","146","8","04020057","","","","3","10.1061/(ASCE)WR.1943-5452.0001233","https://www.scopus.com/inward/record.uri?eid=2-s2.0-85085508817&doi=10.1061%2f%28ASCE%29WR.1943-5452.0001233&partnerID=40&md5=e3cfd42cf8667f15d0f788708f742534","American Society of Civil Engineers (ASCE)","Article","Final","All Open Access; Green Open Access","Scopus","2-s2.0-85085508817"
"Kim H.J.; Cho K.; Kim Y.; Park H.; Lee J.W.; Kim S.J.; Chae Y.","Kim, Heey Jin (57202061195); Cho, Kyeungwoo (57216896264); Kim, Yeonjoo (55574123272); Park, Hyesun (57193133176); Lee, Ji Wan (36637955900); Kim, Seong Joon (54780152800); Chae, Yeora (35728140700)","57202061195; 57216896264; 55574123272; 57193133176; 36637955900; 54780152800; 35728140700","Spatial Assessment of Water-Use Vulnerability under Future Climate and Socioeconomic Scenarios within a River Basin","2020","Journal of Water Resources Planning and Management","146","7","05020011","","","","3","10.1061/(ASCE)WR.1943-5452.0001235","https://www.scopus.com/inward/record.uri?eid=2-s2.0-85085201078&doi=10.1061%2f%28ASCE%29WR.1943-5452.0001235&partnerID=40&md5=4a8ecf6780efdba0602f520e1f5e1493","American Society of Civil Engineers (ASCE)","Article","Final","","Scopus","2-s2.0-85085201078"
"Rosenberg D.E.; Filion Y.; Teasley R.; Sandoval-Solis S.; Hecht J.S.; Van Zyl J.E.; McMahon G.F.; Horsburgh J.S.; Kasprzyk J.R.; Tarboton D.G.","Rosenberg, David E. (8577634300); Filion, Yves (6603123029); Teasley, Rebecca (15125054900); Sandoval-Solis, Samuel (23995805500); Hecht, Jory S. (43261550100); Van Zyl, Jakobus E. (12242479800); McMahon, George F. (35849790700); Horsburgh, Jeffery S. (22985191200); Kasprzyk, Joseph R. (23972953800); Tarboton, David G. (7003457258)","8577634300; 6603123029; 15125054900; 23995805500; 43261550100; 12242479800; 35849790700; 22985191200; 23972953800; 7003457258","The Next Frontier: Making Research More Reproducible","2020","Journal of Water Resources Planning and Management","146","6","01820002","","","","14","10.1061/(ASCE)WR.1943-5452.0001215","https://www.scopus.com/inward/record.uri?eid=2-s2.0-85083188836&doi=10.1061%2f%28ASCE%29WR.1943-5452.0001215&partnerID=40&md5=2c78d5536a43955fd9a71b85c6184ed3","American Society of Civil Engineers (ASCE)","Review","Final","All Open Access; Bronze Open Access; Green Open Access","Scopus","2-s2.0-85083188836"
"Giudicianni C.; Herrera M.; Di Nardo A.; Greco R.; Creaco E.; Scala A.","Giudicianni, C. (7801362336); Herrera, M. (35210396100); Di Nardo, A. (7004537402); Greco, R. (7103136996); Creaco, E. (56037591400); Scala, A. (7005366961)","7801362336; 35210396100; 7004537402; 7103136996; 56037591400; 7005366961","Topological Placement of Quality Sensors in Water-Distribution Networks without the Recourse to Hydraulic Modeling","2020","Journal of Water Resources Planning and Management","146","6","04020030","","","","36","10.1061/(ASCE)WR.1943-5452.0001210","https://www.scopus.com/inward/record.uri?eid=2-s2.0-85082299820&doi=10.1061%2f%28ASCE%29WR.1943-5452.0001210&partnerID=40&md5=63a1b7aad1eec8a58d80b835c1720a35","American Society of Civil Engineers (ASCE)","Article","Final","","Scopus","2-s2.0-85082299820"
"Khan H.F.; Yang Y.C.E.; Wi S.","Khan, Hassaan F. (57193502206); Yang, Y. C. Ethan (54785392800); Wi, Sungwook (56465578500)","57193502206; 54785392800; 56465578500","Case Study on Hydropolitics in Afghanistan and Pakistan: Energy and Water Impacts of Kunar River Development","2020","Journal of Water Resources Planning and Management","146","9","05020015","","","","5","10.1061/(ASCE)WR.1943-5452.0001262","https://www.scopus.com/inward/record.uri?eid=2-s2.0-85087921497&doi=10.1061%2f%28ASCE%29WR.1943-5452.0001262&partnerID=40&md5=6ab04834209a859a9418dfef8a913fab","American Society of Civil Engineers (ASCE)","Article","Final","","Scopus","2-s2.0-85087921497"
"Jiang H.; Simonovic S.P.; Yu Z.; Wang W.","Jiang, Haiyan (57199202407); Simonovic, Slobodan P. (7006029957); Yu, Zhongbo (56463248400); Wang, Weiguang (55924669700)","57199202407; 7006029957; 56463248400; 55924669700","System Dynamics Simulation Model for Flood Management of the Three Gorges Reservoir","2020","Journal of Water Resources Planning and Management","146","7","05020009","","","","5","10.1061/(ASCE)WR.1943-5452.0001216","https://www.scopus.com/inward/record.uri?eid=2-s2.0-85083873447&doi=10.1061%2f%28ASCE%29WR.1943-5452.0001216&partnerID=40&md5=43f76f8e2e7dda58289c47d568a60800","American Society of Civil Engineers (ASCE)","Article","Final","","Scopus","2-s2.0-85083873447"
"Elsayed H.; Djordjević S.; Savić D.A.; Tsoukalas I.; Makropoulos C.","Elsayed, Hamdy (55921949300); Djordjević, Slobodan (54945287200); Savić, Dragan A. (35580202000); Tsoukalas, Ioannis (56400687400); Makropoulos, Christos (55953606300)","55921949300; 54945287200; 35580202000; 56400687400; 55953606300","The Nile Water-Food-Energy Nexus under Uncertainty: Impacts of the Grand Ethiopian Renaissance Dam","2020","Journal of Water Resources Planning and Management","146","11","04020085","","","","17","10.1061/(ASCE)WR.1943-5452.0001285","https://www.scopus.com/inward/record.uri?eid=2-s2.0-85087913314&doi=10.1061%2f%28ASCE%29WR.1943-5452.0001285&partnerID=40&md5=acdc826643d60446764239896bc5dc07","American Society of Civil Engineers (ASCE)","Article","Final","","Scopus","2-s2.0-85087913314"
"Diáz S.; González J.","Diáz, Sarai (57188870707); González, Javier (57193352394)","57188870707; 57193352394","Analytical Stochastic Microcomponent Modeling Approach to Assess Network Spatial Scale Effects in Water Supply Systems","2020","Journal of Water Resources Planning and Management","146","8","04020065","","","","5","10.1061/(ASCE)WR.1943-5452.0001237","https://www.scopus.com/inward/record.uri?eid=2-s2.0-85085840504&doi=10.1061%2f%28ASCE%29WR.1943-5452.0001237&partnerID=40&md5=1cf5b6ff084bf14df6faf9e2c9c48938","American Society of Civil Engineers (ASCE)","Article","Final","All Open Access; Green Open Access","Scopus","2-s2.0-85085840504"
"Hecht J.S.; Vogel R.M.; McManamay R.A.; Kroll C.N.; Reed J.M.","Hecht, Jory S. (43261550100); Vogel, Richard M. (7201707877); McManamay, Ryan A. (37007674900); Kroll, Charles N. (7003867581); Reed, J. Michael (35568973700)","43261550100; 7201707877; 37007674900; 7003867581; 35568973700","Decision Trees for Incorporating Hypothesis Tests of Hydrologic Alteration into Hydropower-Ecosystem Tradeoffs","2020","Journal of Water Resources Planning and Management","146","5","04020017","","","","3","10.1061/(ASCE)WR.1943-5452.0001184","https://www.scopus.com/inward/record.uri?eid=2-s2.0-85081093817&doi=10.1061%2f%28ASCE%29WR.1943-5452.0001184&partnerID=40&md5=12d632d20fe983f7dd98eef760b16af6","American Society of Civil Engineers (ASCE)","Article","Final","","Scopus","2-s2.0-85081093817"
"Waldron A.; Pecci F.; Stoianov I.","Waldron, Alexander (57219330749); Pecci, Filippo (56825733100); Stoianov, Ivan (23971798600)","57219330749; 56825733100; 23971798600","Regularization of an Inverse Problem for Parameter Estimation in Water Distribution Networks","2020","Journal of Water Resources Planning and Management","146","9","04020076","","","","10","10.1061/(ASCE)WR.1943-5452.0001273","https://www.scopus.com/inward/record.uri?eid=2-s2.0-85092215507&doi=10.1061%2f%28ASCE%29WR.1943-5452.0001273&partnerID=40&md5=4957e0e90bac232db60a5caf0d48ccc5","American Society of Civil Engineers (ASCE)","Article","Final","All Open Access; Green Open Access","Scopus","2-s2.0-85092215507"
"Sivakumar P.; Gorev N.B.; Tanyimboh T.T.; Kodzhespirova I.F.; Suribabu C.R.; Neelakantan T.R.","Sivakumar, P. (55266030000); Gorev, Nikolai B. (7007026723); Tanyimboh, Tiku T. (6603247597); Kodzhespirova, Inna F. (6603223371); Suribabu, C.R. (14822610500); Neelakantan, T.R. (6603051022)","55266030000; 7007026723; 6603247597; 6603223371; 14822610500; 6603051022","Dynamic Pressure-Dependent Simulation of Water Distribution Networks Considering Volume-Driven Demands Based on Noniterative Application of EPANET 2","2020","Journal of Water Resources Planning and Management","146","6","06020005","","","","6","10.1061/(ASCE)WR.1943-5452.0001220","https://www.scopus.com/inward/record.uri?eid=2-s2.0-85082113562&doi=10.1061%2f%28ASCE%29WR.1943-5452.0001220&partnerID=40&md5=e196406202e9ad5d5e2db8d6863846fb","American Society of Civil Engineers (ASCE)","Article","Final","","Scopus","2-s2.0-85082113562"
"Zeng W.; Gong J.; Simpson A.R.; Cazzolato B.S.; Zecchin A.C.; Lambert M.F.","Zeng, Wei (57211365328); Gong, Jinzhe (55355613100); Simpson, Angus R. (7402780493); Cazzolato, Benjamin S. (6603538173); Zecchin, Aaron C. (6506193289); Lambert, Martin F. (24923543300)","57211365328; 55355613100; 7402780493; 6603538173; 6506193289; 24923543300","Paired-IRF Method for Detecting Leaks in Pipe Networks","2020","Journal of Water Resources Planning and Management","146","5","04020021","","","","21","10.1061/(ASCE)WR.1943-5452.0001193","https://www.scopus.com/inward/record.uri?eid=2-s2.0-85082583852&doi=10.1061%2f%28ASCE%29WR.1943-5452.0001193&partnerID=40&md5=84a49c5cf4f2cd14260c742925da32dc","American Society of Civil Engineers (ASCE)","Article","Final","","Scopus","2-s2.0-85082583852"
"Hatam F.; Besner M.-C.; Ebacher G.; Prévost M.","Hatam, Fatemeh (57202834190); Besner, Marie-Claude (6602981160); Ebacher, Gabrielle (35098496300); Prévost, Michèle (7101731160)","57202834190; 6602981160; 35098496300; 7101731160","Limitations of E. coli Monitoring for Confirmation of Contamination in Distribution Systems due to Intrusion under Low Pressure Conditions in the Presence of Disinfectants","2020","Journal of Water Resources Planning and Management","146","8","04020056","","","","6","10.1061/(ASCE)WR.1943-5452.0001256","https://www.scopus.com/inward/record.uri?eid=2-s2.0-85085367594&doi=10.1061%2f%28ASCE%29WR.1943-5452.0001256&partnerID=40&md5=cb1d95c5f225129b1b28494a286b7e10","American Society of Civil Engineers (ASCE)","Article","Final","","Scopus","2-s2.0-85085367594"
"Li F.-F.; Liu C.-M.; Wu Z.-G.; Qiu J.","Li, Fang-Fang (43261228000); Liu, Cong-Min (57209217962); Wu, Zhi-Gang (57213145281); Qiu, Jun (56422957100)","43261228000; 57209217962; 57213145281; 56422957100","Balancing Ecological Requirements and Power Generation in Reservoir Operation in Fish Spawning Seasons","2020","Journal of Water Resources Planning and Management","146","9","04020074","","","","4","10.1061/(ASCE)WR.1943-5452.0001277","https://www.scopus.com/inward/record.uri?eid=2-s2.0-85087509144&doi=10.1061%2f%28ASCE%29WR.1943-5452.0001277&partnerID=40&md5=1274b97c5fa14f40b6061bcef4e103aa","American Society of Civil Engineers (ASCE)","Article","Final","","Scopus","2-s2.0-85087509144"
"Grigg N.S.","Grigg, Neil S. (7005653169)","7005653169","Missouri River Governance: Collective Action and Basin-Wide Problems","2020","Journal of Water Resources Planning and Management","146","5","02520002","","","","0","10.1061/(ASCE)WR.1943-5452.0001196","https://www.scopus.com/inward/record.uri?eid=2-s2.0-85081165596&doi=10.1061%2f%28ASCE%29WR.1943-5452.0001196&partnerID=40&md5=d966f5e611a196ec42af2bbe7b66d6e7","American Society of Civil Engineers (ASCE)","Article","Final","","Scopus","2-s2.0-85081165596"
"Wu X.; Cheng C.; Miao S.; Li G.; Li S.","Wu, Xinyu (36086770400); Cheng, Chuntian (7404796475); Miao, Shumin (56709279300); Li, Gang (56203761000); Li, Shuming (57207110683)","36086770400; 7404796475; 56709279300; 56203761000; 57207110683","Long-Term Market Competition Analysis for Hydropower Stations using SSDP-Games","2020","Journal of Water Resources Planning and Management","146","6","04020037","","","","6","10.1061/(ASCE)WR.1943-5452.0001195","https://www.scopus.com/inward/record.uri?eid=2-s2.0-85082752172&doi=10.1061%2f%28ASCE%29WR.1943-5452.0001195&partnerID=40&md5=6369b33e920d67f52179ad36d7391ddf","American Society of Civil Engineers (ASCE)","Article","Final","","Scopus","2-s2.0-85082752172"
"Fry L.M.; Apps D.; Gronewold A.D.","Fry, Lauren M. (24376259800); Apps, Deanna (56880051200); Gronewold, Andrew D. (24178079300)","24376259800; 56880051200; 24178079300","Operational Seasonal Water Supply and Water Level Forecasting for the Laurentian Great Lakes","2020","Journal of Water Resources Planning and Management","146","9","04020072","","","","13","10.1061/(ASCE)WR.1943-5452.0001214","https://www.scopus.com/inward/record.uri?eid=2-s2.0-85086871337&doi=10.1061%2f%28ASCE%29WR.1943-5452.0001214&partnerID=40&md5=3748517478438eb01330ff34ba1ab5f4","American Society of Civil Engineers (ASCE)","Article","Final","All Open Access; Hybrid Gold Open Access","Scopus","2-s2.0-85086871337"
"Zeff H.; Characklis G.W.; Thurman W.","Zeff, Harrison (55815991900); Characklis, Gregory W. (6603397589); Thurman, Walter (6701717332)","55815991900; 6603397589; 6701717332","How Do Price Surcharges Impact Water Utility Financial Incentives to Pursue Alternative Supplies during Drought?","2020","Journal of Water Resources Planning and Management","146","6","04020042","","","","6","10.1061/(ASCE)WR.1943-5452.0001228","https://www.scopus.com/inward/record.uri?eid=2-s2.0-85083163903&doi=10.1061%2f%28ASCE%29WR.1943-5452.0001228&partnerID=40&md5=c42f1c21de9d44153d4cb9ede77a8bb5","American Society of Civil Engineers (ASCE)","Article","Final","","Scopus","2-s2.0-85083163903"
